"NETFLIXID","COUNTRY","DOWNLOAD","IMAGE","IMDBID","LARGEIMAGE","RATING","RELEASED","RUNTIME","SYNOPSIS","TITLE","TYPE","UNOGSDATE"
"80156943","18","0","http://occ-0-2851-38.1.nflxso.net/dnm/api/v6/evlCitJPPCVCry0BZlEFb5-QjKc/AAAABSMUcvhZWX2rAzq6or-PWYqG569_bebEpN5Lf87AfFOeobt6YUvDuCcI2iHd2zib03Ftfvb3A3QVRGkcu6K0KK434g.jpg?r=96d","notfound","","","2016","3m","Sparks, DoVi, DCI 4K, 59.94 fps, original frames exported from Dolby project, scratch audio","Sparks (AR Fix, DoVi, Scratch Audio)","movie","2020-04-15"
"81089935","18","0","https://occ-0-768-769.1.nflxso.net/dnm/api/v6/evlCitJPPCVCry0BZlEFb5-QjKc/AAAABXDfnGtP5rsjseaOqHY8fViLuVgresmc40-tCzJYq3jAJAFyNVGBkIMC9fUROBpnQ28VHFwt3LqSlLiwJ8yciL365w.jpg?r=cd5","tt1206885","","6.2","2019","1h40m","As damaged war veteran John Rambo seeks a tranquil life, the disappearance of his adopted granddaughter unleashes his raw fury for one final mission.","Rambo: Last Blood","movie","2020-04-16"
"70278880","18","1","https://occ-0-2851-38.1.nflxso.net/dnm/api/v6/evlCitJPPCVCry0BZlEFb5-QjKc/AAAABTj6dqRk-5aYOYTJkOo8TkZXQpGaQjfF5NOFbObHbq1Bc4FaC1hvxNPsYeOtUw-oO979-bCt4zPz46Gab8GGd328_g.jpg?r=be7","tt1807859","https://occ-0-1091-299.1.nflxso.net/dnm/api/v6/evlCitJPPCVCry0BZlEFb5-QjKc/AAAABQ_0APUwaQsKLXtyaesnXFoPchEbZq5e71RElWeta73o2ftsghJLTcBSQTt-KWiMPt4xshpuo5MryHESDGIqC-NoGtuA.jpg?r=9ae","7.7","2010","","Zoologists Martin and Chris Kratt morph from live forms into their animated selves, complete with Creature Power Suits, in this animal show for kids.","Wild Kratts","series","2020-04-16"
"80236318","18","0","https://occ-0-2851-38.1.nflxso.net/dnm/api/v6/evlCitJPPCVCry0BZlEFb5-QjKc/AAAABSmjO73yZPaZH1OGyY1oQOT91snh1NRx1xVUUT10Cd3-dlF8pe1fXIq35Dr_wpjuF45qnuY9E6zQTHQRuPcyIRbeUuBwQV_tSe69H4wrD_uqYUHMzeAQK1NN_as.jpg?r=627","tt10293938","","7.6","2020","","On an island of haves and have-nots, teen John B enlists his three best friends to hunt for a legendary treasure linked to his father&#39;s disappearance.","Outer Banks","series","2020-04-16"
"80214563","18","0","https://occ-0-2851-38.1.nflxso.net/dnm/api/v6/evlCitJPPCVCry0BZlEFb5-QjKc/AAAABdi0FfSuOUMFLu9YAC2n6q8DrHEncdk5l1YUD46xaQY_jIF1sz1WN_cRQkvWHBL1jnUJdOIUv3N5RRSlRmmDorJHsMuAxS0OfJFyUaNPGENgfdx5Xjs8E4pLQHA.jpg?r=2b5","tt11958922","","0","2020","","The Innocence Project unravels missteps and deceit in a series of wrongful convictions, exposing the injustice inflicted on victims and the accused.","The Innocence Files","series","2020-04-16"
"70278879","18","1","https://occ-0-2851-38.1.nflxso.net/dnm/api/v6/evlCitJPPCVCry0BZlEFb5-QjKc/AAAABWhirAknZuYZXknLvGXNfuiFw65fKaQKaQ1_sH1zLGHtuSbI-9ypweP7Gv0Btao-_CaN3qPfWU4RILmHrM6ZMRURiA.jpg?r=e59","tt2014553","https://occ-0-1091-299.1.nflxso.net/dnm/api/v6/evlCitJPPCVCry0BZlEFb5-QjKc/AAAABaQsAwrQdvwKPDvThkcazHuoKiiM6jn5mYdLpDgrTSrqTOcIyoY3WGXG-BLq89npLYgPpCIaBLL3bPVb8HlcqOeAiHDA.jpg?r=e59","7.4","2012","","Continuing the revered traditions of &#39;Mr. Rogers&#39; Neighborhood,&#39; this animated show for preschoolers is based on the adventures of young Daniel Tiger.","Daniel Tiger&#39;s Neighborhood","series","2020-04-16"
"60027713","18","1","https://occ-0-2717-360.1.nflxso.net/dnm/api/v6/evlCitJPPCVCry0BZlEFb5-QjKc/AAAABcPADEjySdmCNxJrnX6owPs92K-0NGAtcYnmtpNLqNsQTXglXWyTSo9MDTxUKFAYoEILjhAM0gNbxzanxRGjCoCc5g.jpg?r=ae6","tt0322259","https://occ-0-2774-2773.1.nflxso.net/dnm/api/v6/evlCitJPPCVCry0BZlEFb5-QjKc/AAAABXWi8cWleYPwFmSJYzCdu4b8EalVrXaprZQvOgoA41Oau4m0IxZ8gEipVc0tNUxtdMaDT2zDMvNfJAeQU-MeXs3ky2l3.jpg?r=ae6","5.9","2003","1h47m","It&#39;s a major double-cross when former cop Brian teams up with his ex-con buddy to transport a shipment of &#39;dirty&#39; money for a shady importer-exporter.","2 Fast 2 Furious","movie","2020-04-17"
"81251949","18","0","https://occ-0-2717-360.1.nflxso.net/dnm/api/v6/evlCitJPPCVCry0BZlEFb5-QjKc/AAAABZANrwD-zpOCf64FXxkqnv5KcYkC1A_HPJhcQgOPu4wTOevqdfZqjdOZZD643jp0YNpZgyDCskSrb4EMoH8yY-7Bhg.jpg?r=275","tt8857590","","6.6","2018","1h40m","Facing pressure to marry immediately, an unemployed man must find a way to pay for a wedding by any means necessary.","Babam&#x131;n Ceketi","movie","2020-04-17"
"70264803","18","1","https://occ-0-2851-38.1.nflxso.net/dnm/api/v6/evlCitJPPCVCry0BZlEFb5-QjKc/AAAABRzC_l9VbDMvhw5oVMM43XAY6jA2ZLguA_2DpaeJQ2srvfKEdv0ebByrHa8y-Y1zXiUiSEFAIBmu76SEnmefFGJ8DA.jpg?r=337","tt1690953","https://occ-0-2774-2773.1.nflxso.net/dnm/api/v6/evlCitJPPCVCry0BZlEFb5-QjKc/AAAABSQRTC7LQdOICRNYaQxSKGRnoYNcC3_cue1w-Z3gKN6qzdFven0eYjsnHrHlfuGnw2qjLzoMbVfaWez4WoFco2odNzWS.jpg?r=2d5","7.3","2013","1h37m","Arch-villain Gru and his three orphan girls return for more shady exploits in this wacky animated feature voiced by some of Hollywood&#39;s biggest stars.","Despicable Me 2","movie","2020-04-17"
"70115629","18","","https://occ-0-2851-38.1.nflxso.net/dnm/api/v6/evlCitJPPCVCry0BZlEFb5-QjKc/AAAABdJH6fHCmYKuIFUDecgAeIZ6iPx5yY2bwV_aprAd8pPr2EUbEKXsy8IQ3MsNuy4ne75OBuBoIYzSeUIQc-nx3ojh_w.jpg?r=58e","tt1323594","https://occ-0-2774-2773.1.nflxso.net/dnm/api/v6/evlCitJPPCVCry0BZlEFb5-QjKc/AAAABW99-8goMpimMHe99ybzfAoiKNq5jPnedSmiY5mNr8uOGFf4yXnvyTqyp1phdCBBvMTqOTbcL0kZTnfXMtKD5KTEYRjp.jpg?r=58e","7.6","2010","1h34m","Villainous Gru hatches a plan to steal the moon from the sky. But he has a tough time staying on task after three orphans land in his care.","Despicable Me","movie","2020-04-17"
"80225841","18","0","https://occ-0-2773-2774.1.nflxso.net/dnm/api/v6/evlCitJPPCVCry0BZlEFb5-QjKc/AAAABc6KcLO8FcxFcIKZR8VXYzDt3oe5G1lJjbU7uJqeelarpdp-uAJCi4Pd2GLkRIl2BQ7ooS7hbF_2qN10Jwx0TiU4Wg.jpg?r=168","tt5164214","https://occ-0-753-1360.1.nflxso.net/dnm/api/v6/evlCitJPPCVCry0BZlEFb5-QjKc/AAAABdDcTfem13icKTLVe99FUE03Xt073YgFQmWmq5Z0eRBNZSk7SQ4Q0C1T_WbudzqAhGyFUfAqhnNitiA4K8Bc8O9lfnpL.jpg?r=168","6.2","2018","1h50m","Debbie Ocean gets out of prison bent on stealing a knockout necklace at the Met Gala. She recruits seven other women to pull off the grand heist.","Ocean&#39;s 8","movie","2020-04-17"
"70157102","18","1","https://occ-0-2717-360.1.nflxso.net/dnm/api/v6/evlCitJPPCVCry0BZlEFb5-QjKc/AAAABfb_J_xbjg4uAfSye8VZrceOstfMpvj6g7QteiKx0WS_tdXUNQWxO4LPUR7oBVTMHHzUWC4-uxqegndyy_ZQ_A0lXw.jpg?r=7c5","tt1596343","https://occ-0-2774-2773.1.nflxso.net/dnm/api/v6/evlCitJPPCVCry0BZlEFb5-QjKc/AAAABe8mF3f0zUJopEHkVPHfP6xVEW13NOVKJdScMbIu72zaYbgtzeELysNDTPlB3Cz5Gmcyu_aMFJJHGXG2qj2HCqjxIGMi.jpg?r=7c5","7.3","2011","2h10m","Brian and Mia break Dom out of prison and head to Brazil to put together a racing team -- and take on a drug dealer who wants to kill them.","Fast Five","movie","2020-04-17"
"70103761","18","1","https://occ-0-2851-38.1.nflxso.net/dnm/api/v6/evlCitJPPCVCry0BZlEFb5-QjKc/AAAABUR4grNFFfchGfcMUOCl4kljkbzcreO-OuHOyeBIRTcymPX42lyi1SD6M8zasJoQL7qehG1gc14ycJSe_RDDUPHWng.jpg?r=a9f","tt1013752","https://occ-0-2774-2773.1.nflxso.net/dnm/api/v6/evlCitJPPCVCry0BZlEFb5-QjKc/AAAABQoivyI-dXgB5ICPyPgLvrP478io1I8RfVD84f_GS8c1FpbfyqBgYw0rw0xiMvvmMtGW8u3u8B6X-dSoDfiO9D_90G8P.jpg?r=a9f","6.6","2009","1h46m","Fugitive Dom Toretto teams with nemesis Brian O&#39;Conner to take on a common enemy in this full-throttle installment of the speed-racing franchise.","Fast and Furious","movie","2020-04-17"
"80019608","18","1","https://occ-0-2851-38.1.nflxso.net/dnm/api/v6/evlCitJPPCVCry0BZlEFb5-QjKc/AAAABbhe9BxALGRaCXWjEXr2D-1Vg8oHvNyP1pmXCJjQWwb2PNvY5xrscETISAFlju0D7fQ9myQE4xA1QhcXi46yvulZgg.jpg?r=6f4","tt2820852","https://occ-0-2430-2433.1.nflxso.net/dnm/api/v6/evlCitJPPCVCry0BZlEFb5-QjKc/AAAABYhUdLfgt0tkxf1q9pywu8NZqW2pzO8baIxL_4uDDBZA372wHM7rD5s1uNNxJteSvRaDBzzkvS-kvRBGIvtBJFwAUDun.jpg?r=6f4","7.2","2015","2h17m","A team of fast-driving outlaws has settled into normal lives, but a man with a vendetta chases them out of their complacency.","Furious 7","movie","2020-04-17"
"70263863","18","1","https://occ-0-2717-360.1.nflxso.net/dnm/api/v6/evlCitJPPCVCry0BZlEFb5-QjKc/AAAABXUPfmC9l3JvYueh4aQ7ShnCUBx9OggrFSCVAe_feqZdeingA92UcFfExz-KRpvgYoO-hSOfSSjZNh-LPteOX7PZiw.jpg?r=214","tt1905041","https://occ-0-2774-2773.1.nflxso.net/dnm/api/v6/evlCitJPPCVCry0BZlEFb5-QjKc/AAAABbrbe52ge6LOzVTC-xfXBvOaghuRsd8Xz2nlY4d5IrUWQ4fvSo2dCfMyUlLKuws4pwYmMQ1Z2bVzupjtMLvdGrQraiWA.jpg?r=214","7.1","2013","2h10m","Street racer Dominic Toretto and his crew again call on their mad driving skills for a major heist that sends them speeding through European streets.","Fast and Furious 6","movie","2020-04-17"
"60020747","18","1","https://occ-0-2851-38.1.nflxso.net/dnm/api/v6/evlCitJPPCVCry0BZlEFb5-QjKc/AAAABYMk778Kub3Fnp0UZVrnOi6WQRBSPZB-6E3AiFTSU9L4JYB_Xpstjm7s4da6bcd14QTbppStg8WkjsQ525-_MWdPKg.jpg?r=7a9","tt0232500","https://occ-0-2774-2773.1.nflxso.net/dnm/api/v6/evlCitJPPCVCry0BZlEFb5-QjKc/AAAABWMa3eq8_Bo0BcmiPYClBt9nBnBm_iX37LDAsnbFclLL9liDp8CMUqWU60l1rqV3kvyE5w4bV8iY8QwHnCb_WoushjuD.jpg?r=7a9","6.8","2001","1h46m","An undercover cop infiltrates a Los Angeles street-racing crew suspected of big-rig hijackings and unexpectedly falls for the gang leader&#39;s sister.","The Fast and the Furious","movie","2020-04-17"
"70044885","18","1","https://occ-0-2851-38.1.nflxso.net/dnm/api/v6/evlCitJPPCVCry0BZlEFb5-QjKc/AAAABe5uv9llH5Gs8pFvSjXG8FBeyz_RDN33tqjnMCRurpXwmx9D4AzoEmUbGieH-7V6VKN1OLjqjoY9jOVLQ3BdSgc8Cw.jpg?r=c1c","tt0463985","https://occ-0-2774-2773.1.nflxso.net/dnm/api/v6/evlCitJPPCVCry0BZlEFb5-QjKc/AAAABckYl3Dnz99Xd_4LSG3TR2aTseLbqIzMfEqsvOkpzEWPneB3qNRZNp29PsUW9UMfSFC-JSPMgAQ7TbLg7aTaJCAACaCL.jpg?r=c1c","6","2006","1h44m","The hit franchise&#39;s third installment finds street-racer Shaun Boswell moving to Tokyo, where he&#39;s been dispatched by his concerned family members.","The Fast and the Furious: Tokyo Drift","movie","2020-04-17"
"81184735","18","0","https://occ-0-2851-38.1.nflxso.net/dnm/api/v6/evlCitJPPCVCry0BZlEFb5-QjKc/AAAABU8P0cOLWkQ9RiKaiPqD5k86U4RzLaE03x0vpVzLHW8_7cdBLlTDZMKvPLvMJqgKO7_471EF4nePdhEnkfMuGWGM0Q.jpg?r=6f8","","","","2019","","As the Roberts family heads to Costa Rica to investigate a mermaid legend, Barbie takes on a summer job at a water park run by a devious boss.","Barbie Dreamhouse Adventures: Go Team Roberts","series","2020-04-17"
"81145241","18","0","http://occ-0-2851-38.1.nflxso.net/dnm/api/v6/evlCitJPPCVCry0BZlEFb5-QjKc/AAAABQppYzNucb0riiCSIdSBAdZW4VsQFKfNPieec4SMI_wB--Op2FKui056sxlBSEqFai8GTv9e7lIMDqJXabUoQ-UeZezYocSiKjLf_NrBxeSxCx7mhFI_Bw9FNG8.jpg?r=659","","","","2020","1h3m","Comedian Maur&iacute;cio Meirelles explores his chaotic mind with scathingly funny views on family, prejudices, turtles and more in this stand-up special.","Maur&iacute;cio Meirelles: Generating Chaos","movie","2020-04-17"
"81102814","18","0","https://occ-0-2717-360.1.nflxso.net/dnm/api/v6/evlCitJPPCVCry0BZlEFb5-QjKc/AAAABYbiFFUuILg-O5417t3pHfv46-6u0M2Ov3F1hClSMcB6p2jvUaNMc0S1X_RrymW9j746CjW_m23weD-j7_b7ThTjaQU6zkUUSx-OQ_obiL9fdD0G0i2Uikih3Jo.jpg?r=c5f","tt10092752","","5.2","2020","1h20m","A sawmill owner and his teenage daughter become tangled in a deadly feud when a drug dealer stashes stolen cocaine on their remote property.","Earth and Blood","movie","2020-04-18"
"81058432","18","0","https://occ-0-2851-38.1.nflxso.net/dnm/api/v6/evlCitJPPCVCry0BZlEFb5-QjKc/AAAABcxlbl4iiYDAfEJPd24Qgf5U4JkWiT3vBwyRsPKmdJwJ53_GsINiCsyoMagbmb57HuQ6Xk97yUuvy_k-SDnr-2t9l6b2cB3BJV1-MOWPfrMGhPugBD08zCXNXlg.jpg?r=907","","","","2020","1h34m","Ready to do anything to get rich, a young man upends the Berlin property market with his shady pal, till the good times threaten to destroy it all.","Rising High","movie","2020-04-18"
"80990327","18","0","https://occ-0-2851-38.1.nflxso.net/dnm/api/v6/evlCitJPPCVCry0BZlEFb5-QjKc/AAAABSmgtn36JxwqwhUKzMT1TnZ4S6-1L6moJc99w0w-f_lfGvxnxYHEnwae40deiBVdeglDAUTYJ_xb1j8hqCXCHRltJYjORe9T3Ta_da3DLF6s8e-56wdAW8TB6Qg.jpg?r=0a6","","https://occ-0-1091-299.1.nflxso.net/dnm/api/v6/evlCitJPPCVCry0BZlEFb5-QjKc/AAAABXULSgW-T6SYryMIQsIjKk99KfLPiTBZD9dPLHjhQREHOR9IfCKuE3Uu_oEVEXhZZq_eCViRPmhnJzjxPOpDx0PE-aaKzaCEmF8fl0Y9kbVzeeOek97yPPu9110usA.jpg?r=77b","","2019","2h1m","A year after solving a series of murders, detective Amaia is faced with a related mystery in the Bazt&aacute;n Valley that ends up hitting very close to home.","The Legacy of the Bones","movie","2020-04-18"
"80191526","18","0","https://occ-0-2851-38.1.nflxso.net/dnm/api/v6/evlCitJPPCVCry0BZlEFb5-QjKc/AAAABQsIP8UAPmj1mP7ToKa4kG4d5tQhJLeS6zXl6g0nth_NYD6B6OJ6QjDrmyyaqNb1Ilzf_ebRHP177UM8WMMBLTk7qstd85va06ultghu2PnRAh36H1MBBoAdXrk.jpg?r=99d","tt8750570","","6.9","2020","1h58m","Passions, ideals and bitter realities collide as charismatic UN diplomat Sergio Vieira de Mello becomes trapped in a life-threatening situation in Iraq.","Sergio","movie","2020-04-18"
"81056700","18","0","https://occ-0-2773-2774.1.nflxso.net/dnm/api/v6/evlCitJPPCVCry0BZlEFb5-QjKc/AAAABSRnhv-4Khg-QYPKScrZr_nJamLxOTCWbgzqBwZKQA795vaE0jf42UCf-o_6TbV7MKgTnPVshiMMfAUROUS59SlcTZ1yMbg1NEqHXGROtwb3dsFpnwO7fiubfM4.jpg?r=906","tt10311562","","6.6","2020","","Kenya Barris and his family navigate relationships, race and culture while grappling with their newfound success in this comedy series.","#blackAF","series","2020-04-18"
"80172949","18","0","https://occ-0-768-769.1.nflxso.net/dnm/api/v6/evlCitJPPCVCry0BZlEFb5-QjKc/AAAABedmdnws2DpDJ4JEc1BE6ZsjpyxCw8aF8ZpAChswyEKVlOiFfVJ4NzdC-WWR9NaeV0_iS7HfEscFBwSSgK6AIkhQOg.jpg?r=381","tt3673794","","8.4","2013","","In the Warring States period, young orphan Xin vows to aid King Zheng of Qin in his quest to unify China by becoming a general himself.","Kingdom","series","2020-04-18"
"80236782","18","0","https://occ-0-2851-38.1.nflxso.net/dnm/api/v6/evlCitJPPCVCry0BZlEFb5-QjKc/AAAABTJS7BonlrG0Z-avd2HKqg5e9Sh1qPhELVTUMOlNDff4RkxufZnHdBmRatNBLvqz1LRFzSIq4WLKLFyAzVU-Sh9oRls2CHsXJVVpVTWz55S8sZvEPV9U3YwsmCQ.jpg?r=cc3","tt9359294","","0","2020","","A timid, small-town comedian&#39;s long-awaited big break takes a dark turn when he realizes committing murder is the only way to keep his onstage mojo.","Hasmukh","series","2020-04-18"
"81218903","18","0","https://occ-0-768-769.1.nflxso.net/dnm/api/v6/evlCitJPPCVCry0BZlEFb5-QjKc/AAAABR558x9DjQkDo3G-SPbuaelRTi-jbLXl6XDliPTEzWWFQ6k_NE0vhjO7cnKN--_UKMV7Mh6O-DyUM-JxVh8uU_OIDsmGRuMUmqdC4_A3WAIHpIA-JmTvpbWcHQk.jpg?r=ac5","tt7605396","https://occ-0-1952-2433.1.nflxso.net/dnm/api/v6/evlCitJPPCVCry0BZlEFb5-QjKc/AAAABfFsYIL2PoOUqaV9h4zPzTw3Lwp2V2moRmasMjaXN7uaJwz7c0J4UGEUAPdaLGOsIBOmuxxBA0-rj4-ewqKkI_kj_aqNHDSdYhRh0wevGiM8Ld-wPEwAZgfAOXWWvA.jpg?r=26e","8.1","2019","","Twelve jurors &mdash; ordinary people with struggles of their own &mdash; must decide the case of a woman accused of killing her best friend and her own daughter.","The Twelve","series","2020-04-18"
"80241027","18","0","https://occ-0-2851-38.1.nflxso.net/dnm/api/v6/evlCitJPPCVCry0BZlEFb5-QjKc/AAAABWHIRwbqBolY3RAeNMvBtqo7ffXTrv813DOYJfQhLqiP1vxunzOzxAa9-EvO1pWeBm4p42DGAWa4YRLxEKqDhz6sRSyK6Axts6OmZ16Ab9hCiq6rYMgCB2AOKPM.jpg?r=935","","","","2020","","On the shores of paradise, gorgeous singles meet and mingle. But there&rsquo;s a twist. To win a $100,000 grand prize, they&rsquo;ll have to give up sex.","Too Hot to Handle","series","2020-04-18"
"80210487","18","0","https://occ-0-2773-2774.1.nflxso.net/dnm/api/v6/evlCitJPPCVCry0BZlEFb5-QjKc/AAAABWvR81Zic3I6a3z9Q96sZy3dw0NY7Mc2WMuqyGXqv1n_gY3SaA7uxHOl1ksnFxrd-MZ1_rxzl0bVZRiBPMrGiRSVag.jpg?r=a7a","tt3981938","","7.4","2014","","Long after the fearsome Bahamut was sealed away, one woman steals half the key from the gods. The race is on to prevent an ancient terror&#39;s release.","Rage of Bahamut: Genesis","series","2020-04-18"
"81177545","18","0","https://occ-0-2851-38.1.nflxso.net/dnm/api/v6/evlCitJPPCVCry0BZlEFb5-QjKc/AAAABYnkRFa0M11XecXbOwTqcx8FZQgEkyxp9ETtfI8QnjhUfn2uJVhm_ZLOSKJ2XjI3RSyOA5lUuFBV3zwDd9vpXPaJ736SDs_glIVExzHrMMSbeFngL-E7ZFLQpuqp1NxdBRcXELTuegF69ID2LiiyCZExfVFa.jpg?r=b27","tt11534164","","8.4","2020","","To survive in a dog-eat-dog world, two rival lawyers with high-class clientele tear apart anything that stands in the way of their ambitions.","Hyena","series","2020-04-19"
"81273582","18","0","https://occ-0-2851-38.1.nflxso.net/dnm/api/v6/evlCitJPPCVCry0BZlEFb5-QjKc/AAAABUQZoselj6ADE9hmUI6RhQhEzM3SSt82bFf7oGHGGL-T_D8DBXfjQStiAIT_YIyd4aRm992_AXIwwz7jZAwoX4B1zw.jpg?r=6ec","tt11531530","","7.1","2020","2h24m","At an apartment complex, the lives of a mother, a daughter seeking an arranged marriage, a military retiree and a young man become intertwined.","Varane Avashyamund","movie","2020-04-20"
"81033374","18","0","https://occ-0-768-769.1.nflxso.net/dnm/api/v6/evlCitJPPCVCry0BZlEFb5-QjKc/AAAABQVB9iGOw_o2S1viM5xTu54snw-5OGfKVy0x81xCFfKd-XOeKw6imjIhKOhK68Dd8w-3xd6capDnjgucnx79TN0yhg.jpg?r=6df","tt2253780","","7.4","2014","","A civilian doctor&#39;s family fights for survival after the Germans occupy their home during the First World War.","In Vlaamse Velden","series","2020-04-20"
"81033364","18","0","https://occ-0-768-769.1.nflxso.net/dnm/api/v6/evlCitJPPCVCry0BZlEFb5-QjKc/AAAABUNb_WFU3gynFslc6QLk3_jNOmo66h_20IWeL5XMEVoygEi4cMz91oi7xSDgPOuofXgQgQ3PDEaI4ECrFs0pile9Jg.jpg?r=897","tt8106538","","8.3","2018","","When a young man gets diagnosed with lymphoma in his prime, he goes from ambitious medical student to struggling medical patient.","Gevoel voor tumor","series","2020-04-20"
"80987903","18","0","https://occ-0-2851-38.1.nflxso.net/dnm/api/v6/evlCitJPPCVCry0BZlEFb5-QjKc/AAAABQjB3ktCy_0HM4ZzjjYiWuFKg0DI1PYdYsN-YQwV862i5je5L5Si1E2GFGAJ2dCo7XpeJud00kz3UkIXlNZ9VC4smIfcOqE6PpQLeltogGU5m1-TFeQE8-pn9YA.jpg?r=05d","tt11639414","","0","2020","","Traversing trippy worlds inside his universe simulator, a space caster explores existential questions about life, death and everything in between.","The Midnight Gospel","series","2020-04-21"
"80203144","18","0","https://occ-0-2851-38.1.nflxso.net/dnm/api/v6/evlCitJPPCVCry0BZlEFb5-QjKc/AAAABSdkQPVipxtGuSio9-dUq5cHyGgq8x_dIexoedmuZ5hmdxF16WfgZIq8HSwyrkXQ1lsCrg2zjMhAltzM9hIEeHxK_p93Sh1HWKEyeLMcPX2DDDnZnFWJgaccchRaEMMS1AKCEZHFGrY9dpdDnBgB8MfMyoQus8ucU32oLy0.jpg?r=2c9","","https://occ-0-2218-2219.1.nflxso.net/dnm/api/v6/evlCitJPPCVCry0BZlEFb5-QjKc/AAAABV6lj9lB5Gwa0tfxNNyfThCUXrRqJO-Qe6vku2FQKpDkBcVb9vG_daOhm8P8w_Oro4rDL5TpGcyIfAj0RzzWoid7DO3r.jpg?r=2c9","","2020","","This docuseries gives a definitive account of Michael Jordan&rsquo;s career and the 1990s Chicago Bulls, packed with unaired footage from the 1997-98 season.","The Last Dance","series","2020-04-21"
"81032347","18","0","https://occ-0-2851-38.1.nflxso.net/dnm/api/v6/evlCitJPPCVCry0BZlEFb5-QjKc/AAAABYiNCEATAzG4BskgSLcTaQYZwfwPpPnKtYBV0mcPL_InDpRynX3kd-OnsKv3UMkMUJ32aNGGIltuyFRTOeDWKjboavgztRaI7r-2vY7SpXkWUuqpnsaFYX68rbY.jpg?r=f59","","https://occ-0-1007-1009.1.nflxso.net/dnm/api/v6/evlCitJPPCVCry0BZlEFb5-QjKc/AAAABYWifxLdJocUG0oH8D6JfDEYio1JaeXepqs3qBvF3YXd_K4uqM83m_31jvTFXda1uzlAlU5S1TjSpHi0tTIAlboG9ypMkvRE9sL0S01jrKN0FNuH4gpeJ3JJs0txeQ.jpg?r=f59","","2020","","Chefs compete to get the hosts and special guests high on elevated cannabis cuisine with their artful use of leafy herb, THC infusions and CBD sauces.","Cooked with Cannabis","series","2020-04-21"
"81122572","18","0","https://occ-0-2851-38.1.nflxso.net/dnm/api/v6/evlCitJPPCVCry0BZlEFb5-QjKc/AAAABQEQCKYLJUCdYeeZP9X8FKLDz6PASbia8YiTpDfRNdrdi08Xx_OxUu-6V8ZpthkprW3z50pBr0xBS7FPhwjc0oONEndjtfLKaDoibC3rj3gnd8ovne811uhtfqk.jpg?r=803","","","","2020","","Comedy duo Thomas Middleditch and Ben Schwartz turn small ideas into epically funny stories in this series of completely improvised comedy specials.","Middleditch and Schwartz","series","2020-04-22"
"81260652","18","0","http://occ-0-1490-1489.1.nflxso.net/dnm/api/v6/evlCitJPPCVCry0BZlEFb5-QjKc/AAAABYgv3_lrD1MxoM2x3CqFzL4sfYxhiA3h4OC4tJmewzpS-eOyBzenNfqvWLvGZycSpcnqdzBec3t58kxBp-L1W2tK-g.jpg?r=59e","tt5514296","","7.3","2016","1h46m","After moving to Kuala Lumpur, Diana lands a secretary job at an ironworks owned by her husband&#39;s old college friend, possibly the world&#39;s worst boss.","My Stupid Boss","movie","2020-04-23"
"81011569","18","0","https://occ-0-2851-38.1.nflxso.net/dnm/api/v6/evlCitJPPCVCry0BZlEFb5-QjKc/AAAABZBGgzO_K1OFSQ1FMo2f1wH60TINCSub8QQOgMGorzTa1Uzzfu0LIguPR57PPhtcaBYK4PBVARvuyGC2sqKgtdZvZu_smz43mK9u4EWs8ySO5nU5V0DISvIlZ48.jpg?r=eb6","tt8727582","","7.6","2020","1h26m","For decades, a nice Jewish couple ran Circus of Books, a porn shop and epicenter for gay LA. Their director daughter documents their life and times.","Circus of Books","movie","2020-04-23"
"81260653","18","0","https://occ-0-2717-360.1.nflxso.net/dnm/api/v6/evlCitJPPCVCry0BZlEFb5-QjKc/AAAABSXgfj-EiJ3RfiONvY0HzENhY93anBxSEzQIXECXdFczreolv_IMCsNr2j78i3TXg5guf3ZxhtXrJtwUIu5sJKCIIA.jpg?r=714","tt10039468","","6.8","2019","1h34m","Having driven away many of his employees, Bossman and three of his long-suffering workers try to find cheap labor in Vietnam but find trouble instead.","My Stupid Boss 2","movie","2020-04-23"
"80200087","18","0","https://occ-0-768-769.1.nflxso.net/dnm/api/v6/evlCitJPPCVCry0BZlEFb5-QjKc/AAAABYCrX8PkVDrVNQZlfyl1c4UIgFxmrfDn4c76Q3nT-VeOxy40gWAOAjfzfpaVSJO422qYLXvSWbFtNTfbY75s2n0QXQ.jpg?r=be1","tt3282076","","4.4","2019","1h28m","A Copenhagen police officer hunts for the man who attacked his partner, only to stumble into a high-stakes game of espionage.","Domino","movie","2020-04-23"
"80216611","18","0","https://occ-0-2851-38.1.nflxso.net/dnm/api/v6/evlCitJPPCVCry0BZlEFb5-QjKc/AAAABYTQxK6R8Taf5ezSoyuI_tAAvbwZFrpRYG9G7QvXQhHJPzudrHZr__hvoyyRfHBFbmX-_dT7TqWVbgio3L2fE2RleTT-_VGviwUOonnaUgi3vXMsKEvXALA-dWk.jpg?r=51b","","","","2019","1h32m","While researching corruption for his new book, a successful crime novelist shades the line between fiction and reality.","The Silence of the Marsh","movie","2020-04-23"
"81260628","18","0","https://occ-0-2851-38.1.nflxso.net/dnm/api/v6/evlCitJPPCVCry0BZlEFb5-QjKc/AAAABTndkZppYLsl9aKLYMyVupQEY6dGj4gwZckBJefKgg_k61a89eZlcCdVQTpqk9PYlWGRK8KDjWi59up_0z6JsYlB8w.jpg?r=1dd","","","","2019","3h0m","A Javanese royal and half-Dutch woman fall in love as Indonesia rises to independence from colonial rule. Based on Pramoedya Ananta Toer&#39;s famed novel.","This Earth of Mankind","movie","2020-04-23"
"81221656","18","0","https://occ-0-2851-38.1.nflxso.net/dnm/api/v6/evlCitJPPCVCry0BZlEFb5-QjKc/AAAABf1K-uR9aA_qC3y9FXHV-y0OcwJ2w1Zs00ZTFeSI_b16eWI79b6i6KUso4FbSua25n9YT5cdYx5ft8iDOsbwJeUWdlC72ZfS-Pvs4SlTFmNUML3TLg8Y-d883UE.jpg?r=b5f","","","","2018","1h33m","After a body is found sewn inside a cow hide, a Wroc&#x142;aw detective discovers a killer is recreating an 18th-century &#39;plague&#39; of criminal punishments.","The Plagues of Breslau","movie","2020-04-23"
"80239482","18","0","https://occ-0-2851-38.1.nflxso.net/dnm/api/v6/evlCitJPPCVCry0BZlEFb5-QjKc/AAAABfQZQIOGSX-d7qVso_iJnZEyT-jrt5aY_QRMgj380_RcC0uvOCdZfIVU_vYKohHRcGOxfQmnQTDBuS7x74JPwXr-iQljxJElWLSTAgccpzBsd5e2KBQg5NEttQY.jpg?r=c2b","tt5206260","","6.5","2020","1h32m","Four siblings with horribly selfish parents hatch a plan to get rid of them for good and form a perfectly imperfect family of their own.","The Willoughbys","movie","2020-04-23"
"81082225","18","0","https://occ-0-2851-38.1.nflxso.net/dnm/api/v6/evlCitJPPCVCry0BZlEFb5-QjKc/AAAABYMDxWE4MpWCY8INRhJPQAIsoDqUzfTA8hpaFOkUxudWZy50SqoZNxJZy51oVEfZ-yHn2G0U5rt31xLxl4AvxUwim8-LzEvo1fRz9Tub8Mb73u5l33ZUYovYrfI.jpg?r=c7a","tt12027008","","0","2020","","A cast of quirky critters and Mother Nature herself narrate this funny science series, which peeks into the lives of Earth&rsquo;s most incredible animals.","Absurd Planet","series","2020-04-23"
"80987454","18","0","https://occ-0-2851-38.1.nflxso.net/dnm/api/v6/evlCitJPPCVCry0BZlEFb5-QjKc/AAAABepEurLa_ohaCExcYfyHOtcsRjthVGn3IJ4WIWfTuB9z1az6nWRSq17ln3uEE6Vyey6pZPCsU9ohmOEybcc55uaWPEK8DYs2I6dK0PDxRXI75YDTVc92k73Up08.jpg?r=2af","tt11718294","https://occ-0-2774-2773.1.nflxso.net/dnm/api/v6/evlCitJPPCVCry0BZlEFb5-QjKc/AAAABVtVROAZd-fSteaxKtWm8R-tqyGohDnXSjLxaRY44EMQjxkxRw1XgJCWGr4E0w8BJPkf-VxnuJKl5DB1pSQgWz4U2WwIG7OnWispwIcbP_9-KXi_Zxkow5CHuIydLA.jpg?r=2af","8.2","2020","","Six couples compete to prove they&#39;ve got the survival skills to win the deed to an extraordinary home deep in the vast, rugged wilderness of Alaska.","Win the Wilderness","series","2020-04-23"
"81258623","18","0","https://occ-0-2717-360.1.nflxso.net/dnm/api/v6/evlCitJPPCVCry0BZlEFb5-QjKc/AAAABXCwlyqnznYegbT0oWUAsWmXG3ddbZxPlulLLSIA4LnkS0xdE6N5lb40XnQdMwdztsdyaIab2O-dRYdn25qrLDk_XQ.jpg?r=b72","tt6280858","","0","2019","1h47m","The speech-and-hearing-impaired heiress of a palatial mansion must rely on basic instincts when a masked invader is determined to kill her.","Kolaiyuthir Kaalam","movie","2020-04-24"
"81266458","18","0","https://occ-0-2851-38.1.nflxso.net/dnm/api/v6/evlCitJPPCVCry0BZlEFb5-QjKc/AAAABWdlRQMK09Fus62JSq79BnwyvtLwlRqaJPgPJtkfCEFMqz9hZluyyBtaiyhKA56rsrgw_Jspc0pDYyIONnTJB38CbEF8HgWrfmDcTVVDfgxOBa6zKGgeX_GRm_k.jpg?r=65c","tt11777040","","6.1","2020","2h14m","Wanting to leave their dystopian world behind for a faraway paradise, three outlaws plot a money heist &mdash; and draw the attention of a vicious killer.","Time to Hunt","movie","2020-04-24"
"81030224","18","0","https://occ-0-2851-38.1.nflxso.net/dnm/api/v6/evlCitJPPCVCry0BZlEFb5-QjKc/AAAABbKDsGcZfE2HZ9895k9mY6lWpl3_4hVCqESQwJigg09sn2YBwgEF2dpNezVdxgtNREJHbG47jWxNRptK-7q8yR5R0L4tQhv2z-FFZFz0SfyBvkkpp6SqCBi5Tdc.jpg?r=ca5","tt9466298","","0","2020","","After a global financial crisis, the world is engulfed in an AI-driven &#39;sustainable war.&#39; It&#39;s up to Section 9 to counter new forms of cyber threats.","Ghost in the Shell: SAC_2045","series","2020-04-24"
"81273583","18","0","https://occ-0-2851-38.1.nflxso.net/dnm/api/v6/evlCitJPPCVCry0BZlEFb5-QjKc/AAAABUeNOAbNyg9JMbr9vqWm0c6fJQYYkbl9cJ9VbH7EWdHzmc9dqqC3HVZF6HFxiNxO2kE1VqhktsKE-K5_kZ0tK-h-8g.jpg?r=edf","tt11199356","","7.1","2020","2h18m","Tired of being single, a smart-aleck meme creator has a chance to prove himself to the girl he loves when he is suddenly appointed CEO of her workplace.","Bheeshma","movie","2020-04-25"
