"NETFLIXID","COUNTRY","DOWNLOAD","IMAGE","IMDBID","LARGEIMAGE","RATING","RELEASED","RUNTIME","SYNOPSIS","TITLE","TYPE","UNOGSDATE"
"60031203","18","1","https://occ-0-768-769.1.nflxso.net/dnm/api/v6/evlCitJPPCVCry0BZlEFb5-QjKc/AAAABSDSQIpGV5MPOnCVtiQPdQrejLvWVk3JrRTdQSpca3BpV9DEcRa-dWhEYYoSj40OeCPyCxcNoNHV3NfjLV9sFubeaQ.jpg?r=d48","tt0285823","https://occ-0-2774-2773.1.nflxso.net/dnm/api/v6/evlCitJPPCVCry0BZlEFb5-QjKc/AAAABSU85IN80pcUExv5F5DxSPhfJaEBnG36GrzevaLFexxiBRcajdE5PUluVDu1QAt1hPpY0Shmy1di4yZqohT7LkD3qFql.jpg?r=d48","6.4","2003","1h41m","In the outlaw trilogy&#39;s final chapter, the CIA recruits roaming vigilante El Mariachi to take down a corrupt general allied with a powerful drug lord.","Once Upon a Time in Mexico","movie","2019-07-30"
"80210294","18","0","https://occ-0-2851-38.1.nflxso.net/dnm/api/v6/evlCitJPPCVCry0BZlEFb5-QjKc/AAAABXKzNYmcAjd-cvExg4tONW25CWCwDCdC_jg2oW0Fts01kJITNNsUhwhOADYggxvteMdpGmuGq9CaC9_ezPOzH_6R1EbEETiUr25vJ45GzKK3lFtRqxuYNHaw_14.jpg?r=4bf","tt8009622","","6.7","2019","","Reggie&#39;s wild imagination unlocks a weird and wonderful world where she can be herself -- and escape the pressures of growing up.","Twelve Forever","series","2019-07-30"
"80213715","18","0","http://occ-0-2851-38.1.nflxso.net/dnm/api/v6/evlCitJPPCVCry0BZlEFb5-QjKc/AAAABRDpUYraz5WVj-49GYZXfhvlch3GmWlyrwlOodRqLJBQTHDcmOsHaA1n_Dt9ceQ-obKloeeydsLdpYpAvysYzRfduAc2JfGndQeqUKg2_ti8imUU7fIBu-AEFhg.jpg?r=965","","","","2019","59m","In her fourth stand-up special, Whitney Cummings returns to her hometown of Washington, D.C., and riffs on modern feminism, technology and more.","Whitney Cummings: Can I Touch It?","movie","2019-07-31"
"81065784","18","0","https://occ-0-2851-38.1.nflxso.net/dnm/api/v6/evlCitJPPCVCry0BZlEFb5-QjKc/AAAABfTnZ3HzBsenex-Z-tamQlzr3PMjv2j2SQPTtFATeHHTArNsc9pKNKbYnLkgxlw4P_ipG0YJPdYnimSeu4ugQs-D3g.jpg?r=37d","tt0422774","","4.2","2018","1h26m","When authorities arrest his young son, a taxi driver must convince the courts and rabid media that he&#39;s not the criminal they seek.","Are We Done Yet?","movie","2019-08-01"
"80193514","18","0","https://occ-0-2851-38.1.nflxso.net/dnm/api/v6/evlCitJPPCVCry0BZlEFb5-QjKc/AAAABb4FhTshUPDx36SWtGcrYQyic9HygKP1YiJuK0z8xVY_i4tybAoejMlhKvAi8f2geGCeOrFAZWZeAP1dgOD43WJdTA.jpg?r=d43","tt3163844","https://occ-0-2774-2773.1.nflxso.net/dnm/api/v6/evlCitJPPCVCry0BZlEFb5-QjKc/AAAABUOBxAyO2wHREYmfk1j1EA37GSXdUOa5_yiviMBwizVqAiTXJRBGKKJwO3RZe0jyiohIaBX2CARYoLXMdVqWUP7g6OLt.jpg?r=d43","6.5","2013","1h30m","Toma and Index meet a singer named Arisa whose powers are linked to a nearly-complete space elevator and a mysterious accident three years earlier.","A Certain Magical Index: The Movie &#xFF0D;The Miracle of Endymion","movie","2019-08-01"
"70138789","18","1","https://occ-0-2851-38.1.nflxso.net/dnm/api/v6/evlCitJPPCVCry0BZlEFb5-QjKc/AAAABYv8dRB5BolpwhYp1QAFnjKtb9MO9hjP4HAJ9tPNWM5usxcpdBJuk2ifRshNrTcWNeW2-AWTfWvwlCkveiRNZVv1EA.jpg?r=813","tt2359006","https://occ-0-1952-2433.1.nflxso.net/dnm/api/v6/evlCitJPPCVCry0BZlEFb5-QjKc/AAAABRnZbhf-l9YmrYg75ke83ivAIcuelhb0j-aZ9TnII4kYSs2U6TAgNI3vBux9vjDaez_uGOG750DYLmDbLUQOPDzhJmtG.jpg?r=813","4.5","2011","1h56m","Led by their skillful staff sergeant, a platoon of gutsy Marines fights to protect all humankind from astonishingly powerful aliens.","Battle: Los Angeles","movie","2019-08-01"
"80124099","18","0","https://occ-0-2851-38.1.nflxso.net/dnm/api/v6/evlCitJPPCVCry0BZlEFb5-QjKc/AAAABd3mEXd6c74VEkMkMBMWBVSBL9tcAYHpUitPm9eaSE3waEdhEyIvobgz4PbZmKqOmGVDQ1XzgSShyTj-YcqUwHn46A.jpg?r=96d","tt3344680","https://occ-0-1091-299.1.nflxso.net/dnm/api/v6/evlCitJPPCVCry0BZlEFb5-QjKc/AAAABRRYgDqww99SSEudqY20Mxw0ni7kajEYnGMHRidFypF_fcZUkQLhLW6lRe5KcM-XB-xUJ8B05PdtrHINjr7BepoAhc9T.jpg?r=96d","7","2016","1h30m","The fourth film in the action franchise finds Boyka taking on brutal gangsters to protect the widow of a man he unintentionally killed in the ring.","Boyka: Undisputed","movie","2019-08-01"
"281550","18","1","https://occ-0-2717-360.1.nflxso.net/dnm/api/v6/evlCitJPPCVCry0BZlEFb5-QjKc/AAAABY4bDlKVQy1gPScDwiNnki73kgX4F9DHxLoEfcYFxB61_Gp8LFnlMTZ7SNfM7bJ1s_oaQjITMJYvtZVwcMLYGT02Lw.jpg?r=a6b","tt0093378","","6.9","1987","1h48m","The plane crash that killed Buddy Holly also took Ritchie Valens, whose modest upbringing and rise to fame are depicted in this exhilarating biopic.","La Bamba","movie","2019-08-01"
"80198859","18","0","https://occ-0-2851-38.1.nflxso.net/dnm/api/v6/evlCitJPPCVCry0BZlEFb5-QjKc/AAAABbnMhYBV7tHpdtK03JYGAIBIk4DKE3YYdOGEg4cg16TbZWx-zJisLW-qcz9ZF90zqwgN5wilq-_nPDKMDgwhT5LS_v8TZZpKxocMJf1w4bEaE4vF12EPWkAqXC4.jpg?r=c57","tt9095526","","6.6","2019","1h36m","Thrust from a violent home into a brutal custody center, a teenager learns to navigate a tough new reality and forge unlikely alliances to survive.","Mon fr&egrave;re","movie","2019-08-01"
"541018","18","1","https://occ-0-2851-38.1.nflxso.net/dnm/api/v6/evlCitJPPCVCry0BZlEFb5-QjKc/AAAABWwCi2jq30nNBi6Xvz4qGpGLPgExpLhrKPo6oV6x4TqtoF0jl9VU2Qz58EfUJ7UWnP623em6Uo0nDlUBHpN5756bAw.jpg?r=d31","tt0087332","https://occ-0-2774-2773.1.nflxso.net/dnm/api/v6/evlCitJPPCVCry0BZlEFb5-QjKc/AAAABW-nrSJ0QfR_nRSZJp-1X3ALSET7UC_6iE1AiaX3QKNJ3mVF_dfLu_xSQeachXwr9bM1sHF3fmoxsEZcku5oWbQkYv91.jpg?r=d31","7.8","1984","1h45m","Parapsychologists create a business exterminating ghouls and hobgoblins -- and end up facing one killer demon in a cellist&#39;s apartment.","Ghostbusters","movie","2019-08-01"
"60022176","18","0","https://occ-0-2773-2774.1.nflxso.net/dnm/api/v6/evlCitJPPCVCry0BZlEFb5-QjKc/AAAABSV0BeQdF1ifoQo0NTnxIWFYxgXJTbxlKdc2cf8Au80U5PocHD_cjhnzm1aSrX1FQVssPU2TPKvhy97uVYi13utFnA.jpg?r=a7b","tt0105616","http://cdn0.nflximg.net/images/6708/23186708.jpg","5.4","1992","1h23m","Tom and Jerry, one of the most famous animated duos of all time, come to life on the silver screen in this magical, music-filled adventure.","Tom and Jerry: The Movie","movie","2019-08-01"
"764186","18","1","https://occ-0-2851-38.1.nflxso.net/dnm/api/v6/evlCitJPPCVCry0BZlEFb5-QjKc/AAAABTsLJW1jGEdpvjDHch4wBYU80pfpdhHBl_btXYxzMrQ3vH7nXk9neL_pvK11HnzaQalrhdcsVjGkNp6271UuBB4YCw.jpg?r=1a4","tt0117057","","6.6","1996","2h6m","Tired of being single, middle-aged professor Rose Morgan accepts her colleague&#39;s proposal -- but her colleague only wants a platonic marriage.","The Mirror Has Two Faces","movie","2019-08-01"
"60029792","18","0","https://occ-0-768-769.1.nflxso.net/dnm/api/v6/evlCitJPPCVCry0BZlEFb5-QjKc/AAAABdONyVWYUCu_VxgnFOuV_iNSBszLsz7n12G46TK3y_fFc0fjS4PBe0swck0uRqtniNRJWUh5zccXTeUkOBp5Wx89BA.jpg?r=90f","tt0065207","","7.7","1968","2h35m","World War II is raging, and a captured American general is being held hostage in Schloss Adler, a Bavarian citadel that&#39;s nearly impossible to breach.","Where Eagles Dare","movie","2019-08-01"
"80242252","18","0","https://occ-0-2773-2774.1.nflxso.net/dnm/api/v6/evlCitJPPCVCry0BZlEFb5-QjKc/AAAABZJA5ETFrNrbQMILb96G-0ZChkilG4J_XMGLnZj_hw8Ty2_38Ye04Og35W5cwwY9iXJMuWzOZxsJCK1JINm0pOS7cg.jpg?r=57a","tt4743226","https://occ-0-1091-299.1.nflxso.net/dnm/api/v6/evlCitJPPCVCry0BZlEFb5-QjKc/AAAABdaKFvH16zD187WUCMgAHbAS13f06x1Mqw3xNf2-hxDseHDpETMbn0zxHuOq42bX6RXAYHJLbSeAGfgPSEZTwjKj0nST.jpg?r=689","3.2","2018","1h36m","Amid World War II, a U.S. fighter trains Chinese aviators to help Chongqing defend itself against brutal Japanese air raids.","The Bombing","movie","2019-08-01"
"80240537","18","0","https://occ-0-2851-38.1.nflxso.net/dnm/api/v6/evlCitJPPCVCry0BZlEFb5-QjKc/AAAABcDyGhiRHSI6XL62j2Tt4Eub52PgRstE1raElGUQ6XXYTB_nCCZKgxjHkwKwjzaOFoaykuVDca-nHWeFg0JQ24yIugg3eSEBbp00ki6RzD0UkPPw_9CCkOyLrpc.jpg?r=9d9","","","","2019","2h10m","Undercover agents open up a fake hotel to real tourists as a cover to help smuggle thousands of Ethiopian refugees to safety. Inspired by true events.","The Red Sea Diving Resort","movie","2019-08-01"
"80992228","18","0","https://occ-0-2851-38.1.nflxso.net/dnm/api/v6/evlCitJPPCVCry0BZlEFb5-QjKc/AAAABRYl5AJYEamz4s_2XgXkXxJUBABweeYhm_jLU4FUcRIduuCBhv01y3xOJInYIZZEHFTyPyec9sGlaHvEtu2RQ5nsvbVBJ_UhA6EwWVTHtop9RzOwXUd11qbi3hI.jpg?r=583","","","","2019","","Ohma Tokita enters a hidden world where corporate disputes are settled in brutal gladiator bouts. Forget the money, he just wants to fight -- and win.","KENGAN ASHURA","series","2019-08-01"
"70308793","18","1","https://occ-0-2851-38.1.nflxso.net/dnm/api/v6/evlCitJPPCVCry0BZlEFb5-QjKc/AAAABXatHisc0GMgqYGJGpRhhQt_HAOOxt87BdAIaLVfDEosrT7iCWAo-OasJl1ULsn05h5y_R5GRLVOyQoaGngbWyRZCw.jpg?r=41b","tt0845738","https://occ-0-2774-2773.1.nflxso.net/dnm/api/v6/evlCitJPPCVCry0BZlEFb5-QjKc/AAAABRXT9_R1g4QL86Durk_iSeihFERxo_LPBllj93T1By1Xaxi9Fw3f-7xreGk4QVz77NOBo-qCqE7qEr-cVCrWygPJa87P.jpg?r=f86","8","2006","","New to rural Hinamizawa, Keiichi discovers a series of murders in its past. But his new friends refuse to speak of them and seem to be monitoring him.","When They Cry","series","2019-08-01"
"70308190","18","0","https://occ-0-2851-38.1.nflxso.net/dnm/api/v6/evlCitJPPCVCry0BZlEFb5-QjKc/AAAABdUTwbh7C9XOyz28AUmNVEOHLvich88FjmZZVlM-S7mWzIlpfUeVK1K-6VyGB1SNccTwKHdl4WA8a6NxeueQGDXTpA.jpg?r=6fa","tt1515996","https://occ-0-2774-2773.1.nflxso.net/dnm/api/v6/evlCitJPPCVCry0BZlEFb5-QjKc/AAAABSZ9y70i9eNjxLND3OVda2g_6vEui3HoO461XHEIzm3N4q-0ILX28IDIsxZnwYYJ5MLZTGwiIw2eA7WUd2YsP3WyxXrN.jpg?r=6fa","7.5","2009","","Mikoto uses her ability to control electricity to help maintain order in Academy City, most of whose inhabitants are mystically gifted students.","A Certain Scientific Railgun","series","2019-08-01"
"70308188","18","1","https://occ-0-2851-38.1.nflxso.net/dnm/api/v6/evlCitJPPCVCry0BZlEFb5-QjKc/AAAABSPjLPqEoTDi_xTkfps6hovPbmqDmIymtBITMv5BUfNYlSUwgrH2TkIv7vQP1QH5rDS9Cp9yThU9tLRdwNSjula-Zw.jpg?r=957","tt1308089","https://occ-0-2774-2773.1.nflxso.net/dnm/api/v6/evlCitJPPCVCry0BZlEFb5-QjKc/AAAABWKMWy-qyPabZJFWK2IdCbpbeL5K-G1bVdwkdpdeUwW7zaOljeDfB9Z8RXrhRQUeYMEMG26fjOEZU_78ahSmkBln8Fp_.jpg?r=957","6.9","2009","","Supernaturally gifted teen T&#x14D;ma teams up with nun Index against evil forces seeking powerful magical texts that have been implanted in Index&#39;s mind.","A Certain Magical Index","series","2019-08-01"
"80234414","18","0","https://occ-0-2851-38.1.nflxso.net/dnm/api/v6/evlCitJPPCVCry0BZlEFb5-QjKc/AAAABQjyPErhDn0uAk3jo1kE5R6hvAfsVzYmpO_LVWBY4eujzhOFyLGHHE8ID-PaYgTZgv0KQQWyRfce3eONFpQQ9ATkCQ.jpg?r=ac0","tt5819414","","4.4","2016","","A stylist, a hair designer and a makeup artist team up to give Britain&#39;s biggest fashion disasters some much-needed makeunders.","100% Hotter","series","2019-08-01"
"80022607","18","0","https://occ-0-2717-360.1.nflxso.net/dnm/api/v6/evlCitJPPCVCry0BZlEFb5-QjKc/AAAABa5QF3z7R6zNR1GpemOTAAXimE51UECHRDP1BMe7gU9PiVK_ASb1uqMBcamQRwhAfvcQyiLTh-9aVFSBTrODrlzXFw.jpg?r=396","tt3416532","","7.5","2016","1h48m","Overwhelmed by his mother&rsquo;s illness, a young boy begins to understand human complexity through the fantastic tales of a consoling tree monster.","A Monster Calls","movie","2019-08-02"
"81150918","18","0","https://occ-0-2851-38.1.nflxso.net/dnm/api/v6/evlCitJPPCVCry0BZlEFb5-QjKc/AAAABb2Oa_PT1DUUXTQQRi8MidooVfit4N83ksMERUyq-u4A7iTwyI9dJJnoXqwwySf99dD9hovXree830Vz3ut_XMdpAA.jpg?r=e0b","","","","2019","1h24m","Best friends L&eacute;a and Camille explore the notion of healing while traveling to Latin America in search of a cure for a terminal disease.","L&eacute;a and I","movie","2019-08-02"
"80238910","18","0","https://occ-0-1926-41.1.nflxso.net/dnm/api/v6/evlCitJPPCVCry0BZlEFb5-QjKc/AAAABSi1UXInRjoNTm6fqNl8trmi4Qh5etFw8WILE9STsAn4KiiC15WhNTH3vFv8_7Rrn-jzkDKCEkP94-wT3zccsG_M2Q.jpg?r=a8e","tt7784604","https://occ-0-1091-299.1.nflxso.net/dnm/api/v6/evlCitJPPCVCry0BZlEFb5-QjKc/AAAABaqr6e4pkcDcLfVluJ4LySI_REte12FXsPcAwT9PNxg06tVukjtrXjXgRfCQUWL9wX2zA0tiX7qfrH4HJ8RYuP-wR_2n.jpg?r=395","7.3","2018","2h7m","After the death of her mother, artist Annie and her family uncover their terrifying legacy and grapple with malevolent forces beyond their control.","Hereditary","movie","2019-08-03"
"80147402","18","0","https://occ-0-2773-2774.1.nflxso.net/dnm/api/v6/evlCitJPPCVCry0BZlEFb5-QjKc/AAAABRx6lZK8-yl6-Eu92vr11F0BFxFqla8NXR9Zbrn2JBRkc8yI1ORIyHRY8uUSexITG_Q4wnIRscUSHAKi0zFWoM9fUA.jpg?r=3e2","tt2720826","","5.5","2016","1h35m","A young Bruce Lee angers kung fu traditionalists by teaching outsiders, leading to a showdown with a Shaolin master in this film based on real events.","Birth of the Dragon","movie","2019-08-03"
"80211623","18","0","https://occ-0-2717-360.1.nflxso.net/dnm/api/v6/evlCitJPPCVCry0BZlEFb5-QjKc/AAAABVHIpZiSjP7ajLp1qHs-LOSUHXtri5zmZe_wF5hJo-UqbOR-VSVI8CvVsJjTZupcWjGhMW5SSCzWNCWf200baPKzL7tfexWU0f5g-QrrnZU4G-MrCSroG4-1LGM.jpg?r=ab7","tt4180560","","6","2019","1h40m","Feeling forgotten on Mother&#39;s Day, three best friends leave the suburbs and drive to New York City to surprise their adult sons.","Otherhood","movie","2019-08-03"
"80232871","18","0","https://occ-0-768-769.1.nflxso.net/dnm/api/v6/evlCitJPPCVCry0BZlEFb5-QjKc/AAAABcElI6cHH_FuySWHz6TtKv6dtVwMiPSyU-2IxqVO51847CiMiO8Lb9VVWEHe6hgcu_fhVOEMR2u2kZ6aaDuSvbTHNw.jpg?r=823","tt4154916","https://occ-0-1091-299.1.nflxso.net/dnm/api/v6/evlCitJPPCVCry0BZlEFb5-QjKc/AAAABTlzvSB2_5HZ0v_VXGRpYePZzg3qvhOGdVSPosm6GtlfiZ2yDtyzS4vlacJ83pPM9VGuuKonSYBTScWBcZqi4MO6RV2d.jpg?r=880","5.5","2018","1h47m","After losing his family in a tragic accident, a neuroscientist tries to bring them back in a cloning experiment that attracts controversy and chaos.","Replicas","movie","2019-08-03"
"80199381","18","0","https://occ-0-1926-41.1.nflxso.net/dnm/api/v6/evlCitJPPCVCry0BZlEFb5-QjKc/AAAABQ0g1ajniWYYKhpjBx2ZOleTQk57CtNQf0VMqY81JFCXwLY-NZUPBsoqTV4-0P1uwTdYnnPKshKw-FcO2HgcCXzF5w.jpg?r=b8a","tt5478478","https://occ-0-1091-1167.1.nflxso.net/dnm/api/v6/evlCitJPPCVCry0BZlEFb5-QjKc/AAAABb5m-wZVIDtFjXa69wPK9Mcg_8f7MTpG0ll1txWBhLhZ-6WH2FDgl3-T-j4Z3zHtGlM5nV6-BJLxh7MoejyiuV3uC-mj.jpg?r=196","7.2","2017","2h13m","After a long career battling the Cheyenne, a U.S. Army captain is ordered to safely escort the tribe&#39;s most influential chief to his Montana homeland.","Hostiles","movie","2019-08-03"
"80238908","18","0","https://occ-0-2773-2774.1.nflxso.net/dnm/api/v6/evlCitJPPCVCry0BZlEFb5-QjKc/AAAABYvUBjKnXnL76gaF1dLq9PWyEV2aeTSx4jRwj40zWvSCe1y7uQFVsb_-sInreYy16wauLVhXyHx0-af6ASCRIJfWPw.jpg?r=a00","tt5774450","","6.7","2018","1h45m","Convinced his neighbor is a serial killer, a suburban teen recruits three pals to help confirm his hunch, but their investigation soon gets dangerous.","Summer of 84","movie","2019-08-03"
"81041374","18","0","https://occ-0-1490-1489.1.nflxso.net/dnm/api/v6/evlCitJPPCVCry0BZlEFb5-QjKc/AAAABWZWO2GuErPDZNDxxfuL5eqFaIvmwCAit6ljQIOpZyVJHxRGwWifO5MARkSkQiWBabOF2j9bq3yt12CIjxCrF9B2kA.jpg?r=0cb","","","","2017","1h41m","Facing financial ruin, an amateur sailor falsely competes in the 1968 Golden Globe Race and opts for a solo voyage that sends him on a downward spiral.","The Mercy","movie","2019-08-03"
"80245353","18","0","https://occ-0-2851-38.1.nflxso.net/dnm/api/v6/evlCitJPPCVCry0BZlEFb5-QjKc/AAAABYcKLHfkbEUEADfKM00FCyvuQX9uivZOuZwwnOF7nXUDcXtf1Vtp-GR2slSdiXpMY6WKuU842BvaX1xVU57CnR3AbwO2B4nhDsG079_9Wjfos1U_xyqKY-J0jdQ.jpg?r=af5","","","","2019","","Follow the Chinle High basketball team in Arizona&#39;s Navajo Nation on a quest to win a state championship and bring pride to their isolated community.","Basketball or Nothing","series","2019-08-03"
"81035835","18","0","https://occ-0-2851-38.1.nflxso.net/dnm/api/v6/evlCitJPPCVCry0BZlEFb5-QjKc/AAAABXAqvq64xnypwAJnXR5bL5zxAZp_ZdtndGutNj3-ePXP4jIM0bEJqQ8H7JaYbPnZyMCX4SofjNz4ccH6v6EgIizFmQ.jpg?r=5e8","tt6034164","","4.6","2017","1h39m","A man begins to regret his choices when his brother decides to join him as a member of the same terrorist organization.","Detention Letter","movie","2019-08-05"
"81082125","18","0","https://occ-0-2851-38.1.nflxso.net/dnm/api/v6/evlCitJPPCVCry0BZlEFb5-QjKc/AAAABVsPUta4W7m4bCuv6tTXzD_gajOsGatcyiBcotuXGtelwIIwZHqzRLqtPVOXPt1LFvFL6v-_YCPpi5AJogQi9mGZJ2ml-SP9EJdixCHwg_nvr6aFk2KiBNhTqZs.jpg?r=14f","","","","2019","1h3m","Years spent recording footage of creatures from every corner of the globe is bound to produce a bit of drama. Here&#39;s a behind-the-scenes look.","Our Planet - Behind The Scenes","movie","2019-08-05"
"81143771","18","0","https://occ-0-2851-38.1.nflxso.net/dnm/api/v6/evlCitJPPCVCry0BZlEFb5-QjKc/AAAABemuS6fU4ONODAZqILYW5BlIMbbWT8CQuwxAHX_CPJJl6H3CrFzGMGkkNP6nJgVJvGlR0IoQGFHxyAx1coyQomzaJsIvcb0vohrv2F_mGlDQzgLcQe8jumlxIkU.jpg?r=75e","","","","2019","58m","What is anime? Through deep-dives with notable masterminds of this electrifying genre, this fast-paced peek behind the curtain seeks to find the answers.","Enter the Anime","movie","2019-08-06"
"81047680","18","0","https://occ-0-2851-38.1.nflxso.net/dnm/api/v6/evlCitJPPCVCry0BZlEFb5-QjKc/AAAABcILVUszXQDmk9ijDgeYFRnyiAK6MhUokRannMLF4SmDyujR8p2HhCdJjEDrgWsAh-FKTJvIXUwws7w47ZOYvuHIpw.jpg?r=1d3","tt8819596","","7.2","2018","1h44m","A steroid peddler explains how he went from an unlicensed anti-aging expert to the point man for the biggest scandal in baseball history.","Screwball","movie","2019-08-06"
"80050006","18","1","http://occ-0-2851-38.1.nflxso.net/dnm/api/v6/evlCitJPPCVCry0BZlEFb5-QjKc/AAAABYnp2lNwrebq9Vllm3qvSLY6F3Y8pGJ-GMnHuTL8R3p_VxYB8gUk55UKR2QFMxhprZv-4QdZJ2Q102LMKsUVhZyRO88EuZPSnne6YGQR5edltLyl8-sVukYN_Yw.jpg?r=ee4","tt0120915","http://cdn1.nflximg.net/images/9495/23919495.jpg","6.5","2015","1h7m","In a witty solo show, Brent Morin serves up infectious laughs on the agony of puberty, hot guy problems and the time a girl dumped him for a magician.","I&#39;m Brent Morin","movie","2019-08-06"
"80002621","18","1","http://occ-0-2773-2774.1.nflxso.net/dnm/api/v6/evlCitJPPCVCry0BZlEFb5-QjKc/AAAABT7fJ4GQNZ5RiHXMBBJEFwf-mIky6iwsMjlqI5c_V_sEIboMB6j5AEdt2ue8SyxAqiHthidCAXHtOLvnesZ0iKuVgI-_wfC7nIpxWugpZy5i0LDwRW9aB4Nlh94.jpg?r=38c","tt3958494","https://occ-0-1091-299.1.nflxso.net/dnm/api/v6/evlCitJPPCVCry0BZlEFb5-QjKc/AAAABZK05b5y8MLpGtKxAuJpD83LHVx7cC-aauqUBRJk0jgwiVDDxu4DCqZe0KxC2vVxi_IMO7q7fFQzUNvFXrfyp6qLQkE5lKRLXpnY7zt6Y6265c7O-j2Fm1jlhT5jbQ.jpg?r=38c","8.1","2014","1h16m","Nothing is sacred in this show from Australian comic Jim Jefferies, whether it&rsquo;s the mother of his child, auditioning disabled actors, or gun control.","Jim Jefferies : BARE","movie","2019-08-06"
"81112446","18","0","https://occ-0-2851-38.1.nflxso.net/dnm/api/v6/evlCitJPPCVCry0BZlEFb5-QjKc/AAAABXBN1xO5idE9dQJvPFSlx8IeRDluapO0eukIIMZ2rph1KoUPrkeDq0PVc8DxDFlcQjHtoY0OePVKCI6MYLRtpl9LYQ.jpg?r=946","tt8130968","","7.9","2019","1h57m","When a woman is accused of killing her lover, a renowned lawyer is hired -- but the more they try to  untangle the truth, the more convoluted it becomes.","Badla","movie","2019-08-07"
"81044970","18","0","https://occ-0-768-769.1.nflxso.net/dnm/api/v6/evlCitJPPCVCry0BZlEFb5-QjKc/AAAABRTTDvn3IEOGtSG7U_0YVOv4J7ic6R-kngBAT9mqIeyDoC2KVuhSroDIXwgTnQ_H_CtEDEt49z_jC9U3vyPi3dmz7w.jpg?r=463","","","","2018","1h26m","An insecure veterinarian falls for the owner of a sick dog, but when he returns her feelings she refuses to believe they&rsquo;re real.","Zwaar Verliefd!","movie","2019-08-07"
"80040119","18","1","https://occ-0-2851-38.1.nflxso.net/dnm/api/v6/evlCitJPPCVCry0BZlEFb5-QjKc/AAAABd65NJUV7IGNv8xQFIxZYiJ6qQn95ws5y99UUmSAhdK7PEdxcGd9rYzsTBRFA4yEOm7K3T5qy1y_MhhJmFXbXjdLxQ.jpg?r=aeb","tt1584000","https://occ-0-2774-2773.1.nflxso.net/dnm/api/v6/evlCitJPPCVCry0BZlEFb5-QjKc/AAAABQnaU5ATtJDT9AyzB9bu_y-R9KRWuQImRl8BIanGrpFRJU5zsI0X4vnPXED7zXsuXE7x-BezvK2PfklHDJPp-cAJhH94.jpg?r=cc8","7.9","2010","","A young man looking for excitement moves to Ikebukuro, a district in Tokyo, where he finds a world of mystery in which the past and present mesh.","Durarara!!","series","2019-08-07"
"81041273","18","0","http://occ-0-2851-38.1.nflxso.net/dnm/api/v6/evlCitJPPCVCry0BZlEFb5-QjKc/AAAABTUL55he6O3it6aUTDm_lz4AcIFrR-o8aiwJ_CSmlhtrVvgcZUkDt5ZTapzy6jWuJ-wLJYVKaU3-mGlPriG0Dt4RLwlnzZlHQ1DIFH-4-7_a7uRNEvQnNe7MxvU.jpg?r=5ef","tt9861498","","6.7","2019","1h5m","Italian comedian Edoardo Ferrario riffs on life at 30 and unpacks the peculiarities of global travel, social media and people who like craft beer.","Edoardo Ferrario: Temi Caldi","movie","2019-08-07"
"80225421","18","0","http://occ-0-2851-38.1.nflxso.net/dnm/api/v6/evlCitJPPCVCry0BZlEFb5-QjKc/AAAABX4Ll_Zji_mgyX2uvpPSDIHUdhexe2nSyTbB0stBoE2QO_hC7PXQNC5P_N6AkXTDJDqj59sYSx6w1zFnpLM0n6J5apV0Cuk0v9l9gWt14GtGabnp1oRhCUi3fjc.jpg?r=a0a","tt7310916","","7.5","2018","1h30m","In this one-man Broadway show, John Leguizamo finds humor and heartbreak as he traces 3,000 years of Latin history in an effort to help his bullied son.","John Leguizamo&#39;s Latin History for Morons","movie","2019-08-07"
"81041272","18","0","http://occ-0-2851-38.1.nflxso.net/dnm/api/v6/evlCitJPPCVCry0BZlEFb5-QjKc/AAAABeXjp0BGRf4JfXB_cdwn_beMB4zHnQvnfHue92jkC631etY9F_1-RO3SHhuyxep88mbiKdng4TL4C10RDc-AeQYsE6Ti4bCmKAX_nR_RmPHlJS6uP2kID9d6p74.jpg?r=9bf","tt10087952","","0","2019","1h1m","Taking the stage in Milan, Francesco De Carlo opens up about his bad habits, religion, politics and what he&#39;s learned from traveling the world.","Francesco De Carlo: Cose di Questo Mondo","movie","2019-08-07"
"80216779","18","0","http://occ-0-2851-38.1.nflxso.net/dnm/api/v6/evlCitJPPCVCry0BZlEFb5-QjKc/AAAABa-1-Yuuk6XW_a-0sSkM9vsnIGqQff5k4CupFuBp5W0v-k5r9CzBeu5TNCsKTy2y1ZErseHbIrt_fsI79X4OhETRxZxV88RcNblXRZmAo2HtlU8MfEzwSE6PGzs.jpg?r=2ea","tt8101766","","7.2","2019","58m","Ray Romano cut his stand-up teeth at the Comedy Cellar in New York. Now, in his first comedy special in 23 years, he returns to where it all began.","Ray Romano: Right Here, Around the Corner","movie","2019-08-07"
"80218104","18","0","http://occ-0-2851-38.1.nflxso.net/dnm/api/v6/evlCitJPPCVCry0BZlEFb5-QjKc/AAAABW1E4Zle7acrw2JE2K09k3Ry7TvOc-0GBig9hDb7lAhmzmutTFeRLdy6MocI2r1rAy7XmeppsEA7IO-5S6e2gMGzJCXCQaCQkJaF6Mh7MEcwYsMbXWcX9QtpYLE.jpg?r=ca5","tt9482786","","7.1","2019","1h5m","Sebastian Maniscalco brings an acerbically unique approach to peacocks on planes, life hacks, rich in-laws and life&#39;s annoyances in this comedy special.","Sebastian Maniscalco: Stay Hungry","movie","2019-08-07"
"80995991","18","0","http://occ-0-2851-38.1.nflxso.net/dnm/api/v6/evlCitJPPCVCry0BZlEFb5-QjKc/AAAABczp6VZ-PRD0ndb_I836bBGFxp_poixvDqQoJR-6Zbsf1kBuFC20kK02LLbrM0fK0yXOdDXmC4r66nBuEY_BxmUMQduT63z1ypvHa8OygGHYBpFph00-J1B4W0A.jpg?r=64f","tt9315848","","7","2018","1h7m","The world&#39;s got a lot of problems, but Vir Das has a lot of answers as he discusses travel, religion, his childhood and more in this stand-up special.","Vir Das: Losing It","movie","2019-08-07"
"81001278","18","0","http://occ-0-2851-38.1.nflxso.net/dnm/api/v6/evlCitJPPCVCry0BZlEFb5-QjKc/AAAABbSgEuDYtRhcS1723zVPBj0QkdOpTPQylxjeHkYPzh_kS9shM__VOufNqcqFmVW0PeL8D_c9gNWhbb4gQ0Ed-nl_7g.jpg?r=ccf","tt6295304","","7.3","2016","1h3m","Sebastian Maniscalco delivers an expressive stand-up at the legendary Beacon Theatre on Whole Foods, family nicknames and dodging obnoxious neighbors.","Sebastian Maniscalco: Why Would You Do That?","movie","2019-08-07"
"81002880","18","0","http://occ-0-2851-38.1.nflxso.net/dnm/api/v6/evlCitJPPCVCry0BZlEFb5-QjKc/AAAABZdc4qV33n0m3L3VEcLf4r9sLMkgfycc15JCXJUrUw3xMwCKJsw6LSAXasjbEm6d9jC2eG2Ba1zTTcVQzKJFeC2ckrB1oWTzUWDFVsiLMuCV-vEQ6bbx2eDL9gI.jpg?r=a58","tt9861504","","7.5","2019","1h0m","Comic Nate Bargatze touches on air travel, cheap weddings, college football, chocolate milk and the perils of ordering coffee in this stand-up special.","Nate Bargatze: The Tennessee Kid","movie","2019-08-07"
"80158802","18","0","http://occ-0-2851-38.1.nflxso.net/dnm/api/v6/evlCitJPPCVCry0BZlEFb5-QjKc/AAAABTUhfVJtk9DyubIhuGn1eozKL_yVvXDqBeQWTXqFh7CbqXzbc9YeStFnXaF74VheMVXK8iECI1T9UtB3cyWnrITIJvkw8zUPIuCRN1RPHCLTnFeJuctVtj5uADw.jpg?r=e73","tt7725144","","7.2","2018","56m","With his signature one-liners and drawings, Demetri Martin muses on doughnut holes, dogs, sports bars, the alphabet&#39;s most aggressive letters and more.","Demetri Martin: The Overthinker","movie","2019-08-07"
"80216677","18","0","http://occ-0-2851-38.1.nflxso.net/dnm/api/v6/evlCitJPPCVCry0BZlEFb5-QjKc/AAAABV-Sn6Ev7maMQaBqny4BbmHEXJ4gtOWHNkAK2oDDhS0qyLLEZk0VNEDLT3enfL5of-epQ3pkV1TJz-0T9QA2mZVVm9HctTVhNzQsVVfDbTx6RUbFiQhwUMXPkew.jpg?r=13d","tt9077188","","7.1","2018","49m","Illusionist Derren Brown concocts a psychological experiment in which he tries to manipulate an ordinary person into taking a bullet for a stranger.","Derren Brown: Sacrifice","movie","2019-08-07"
"80080617","18","1","http://occ-0-2851-38.1.nflxso.net/dnm/api/v6/evlCitJPPCVCry0BZlEFb5-QjKc/AAAABdO5M6M7wx4VaNequlR-HuW1xYlvfysHQOdYSQlZW3KiqPYwQB8XA3OJrC_m-p9WBpVxIxaDvvKX_NXDbJdLV2xbb7tj1-xIL0LZcP-f2u4-V0RgVkudFBZT25c.jpg?r=d1f","tt5066564","http://cdn0.nflximg.net/images/6742/25326742.jpg","5.6","2016","1h6m","Southern charmer Theo Von offers up a twisted take on his dating mishaps, meeting Brad Pitt, chasing down fugitive chimpanzees and more.","Theo Von: No Offense","movie","2019-08-07"
"80232279","18","0","https://occ-0-768-769.1.nflxso.net/dnm/api/v6/evlCitJPPCVCry0BZlEFb5-QjKc/AAAABQDBz6Azb8Mh65J-Ov9fx7DT8JvEKaJ7sOQ1oHxgn8OE_Cly38Gpyxex4PAmbvZAI5veFuCrYLVqgNMey4BH_3YdxA.jpg?r=c45","tt5851786","https://occ-0-2579-1432.1.nflxso.net/dnm/api/v6/evlCitJPPCVCry0BZlEFb5-QjKc/AAAABUT9IFKztGd8up43VBwk4HLdGvIZ6l-bItwuw13S4CWyZYvXXJVatdRQ5dzhzpzEqp08tSurYdrWv6TTn_ZculIUnNSA.jpg?r=c45","5.6","2018","1h25m","After moving into a new house with her mom, high schooler Chloe discovers a troupe of talking garden gnomes who need her help saving the world.","Gnome Alone","movie","2019-08-08"
