"NETFLIXID","COUNTRY","DOWNLOAD","IMAGE","IMDBID","LARGEIMAGE","RATING","RELEASED","RUNTIME","SYNOPSIS","TITLE","TYPE","UNOGSDATE"
"81085123","18","0","https://occ-0-2851-38.1.nflxso.net/dnm/api/v6/evlCitJPPCVCry0BZlEFb5-QjKc/AAAABUrqFOAzIEmoa1r8UiVvostZwaEXUrdUebTGp1DhGMdJmGlhhqSskfqdZYnoycmltJmYeiVDgl6_le4_ONJVdFgBwA.jpg?r=ba6","","https://occ-0-58-2773.1.nflxso.net/dnm/api/v6/evlCitJPPCVCry0BZlEFb5-QjKc/AAAABfY3ciE0g98aaCvml76FDrY19iCsUScdjWnBeiMdYspeEh-dUl_e3WxkpOaFq2f-E2CQUPxE5EZXjhhjwVrZepq7flss.jpg?r=ba6","","2018","","A police officer and an actress with tragic pasts try to overcome their painful wounds and find renewed hope through one another.","Come and Hug Me","series","2020-02-01"
"80244780","18","0","https://occ-0-2851-38.1.nflxso.net/dnm/api/v6/evlCitJPPCVCry0BZlEFb5-QjKc/AAAABWTU97uI7lY_yVdWKoXCqWkbOrrUriVeR2wSiCY0Wz2NKy8alrOv8gTUDNtv4RuIZFXx0niUkSlHttGeK7ltyp_2Kewhx5EZjfxNjWCJpD0RGUeSU1sjsbVyfMA.jpg?r=ede","tt8403622","","5.7","2020","","In 17th-century Italy, a teenager learns about her destiny among a family of witches, just as her boyfriend&#39;s father hunts her down for witchcraft.","Luna Nera","series","2020-02-01"
"80232926","18","0","https://occ-0-2851-38.1.nflxso.net/dnm/api/v6/evlCitJPPCVCry0BZlEFb5-QjKc/AAAABWhFduX9D4jLZ3IUqXq1teCxx0iYyd-VuLnn85s8LgFedzhQokcKLa52Dr_stDNt2wq2Fafp46vqQoY00SpzBRxKYQZ7qXP4S4yR334qQRxFmQfQ65JtrIaYzUI.jpg?r=8ac","tt9251798","","7.5","2020","","In a Norwegian town poisoned by pollution and rattled by melting glaciers, the End Times feel all too real. It&rsquo;ll take a legend to battle an old evil.","Ragnarok","series","2020-02-01"
"81216323","18","0","https://occ-0-768-769.1.nflxso.net/dnm/api/v6/evlCitJPPCVCry0BZlEFb5-QjKc/AAAABZgLjNsts6x98JkHWuL9VzZOnnLljA9Es2CTsOk18mJDXptWq0dAxhRG-uNtWdea8jYNrQXmdiGegYmqlzyrg77quw.jpg?r=7af","tt7875794","","7.4","2019","","Detective William Wisting faces the biggest challenge of his career when a serial killer threatens his town and past events return to haunt him.","Wisting","series","2020-02-01"
"70251818","18","0","https://occ-0-2851-38.1.nflxso.net/dnm/api/v6/evlCitJPPCVCry0BZlEFb5-QjKc/AAAABRWDUBQgUdOxGUQ-iNo1faUx2D2tEvxEKETQOfV2X4OjVYQndgXB3FGhsTJ4LRSR2JtBkqvZkZplLDbnAQOIA6s3lA.jpg?r=4f7","tt4546934","https://occ-0-1007-2705.1.nflxso.net/dnm/api/v6/evlCitJPPCVCry0BZlEFb5-QjKc/AAAABcRSnlCD_2N2ryUyzcfEZ-AOwSq64XI4qGbPSXOONCRiRC6hGCzRP32FL01UbhT5qYJjt-RsYB0hD3VIxTfmWkYkNMcN.jpg?r=4f7","8.3","2015","","Four comedian buddies engage in an ongoing series of outrageous dares. And if they fail to meet the challenge, the penalty is even worse.","Impractical Jokers","series","2020-02-01"
"81085163","18","0","https://occ-0-2851-38.1.nflxso.net/dnm/api/v6/evlCitJPPCVCry0BZlEFb5-QjKc/AAAABXy_nXxe25IKAE_3lQKqA_IXO0CCSURvibx6_x_5vFoRNP0gg7Y2e86la75ZgnbaJ1pmWQK1pp_yxfum5JCHtWv82g.jpg?r=b3d","","","","2018","","A secret service agent who detaches himself from the world after a failed operation tries to unravel the mystery behind a neighbor&rsquo;s death.","My Secret Terius","series","2020-02-01"
"80228291","18","0","https://occ-0-2851-38.1.nflxso.net/dnm/api/v6/evlCitJPPCVCry0BZlEFb5-QjKc/AAAABfkPi1qqfyYE8IpvY0Bs9VLobkA2-0hPzgeMLPxdYm5L-K60B2XS8KD5xW8Czl6LQD7tj-zvmPB5BqzgkdWEIwNvJA.jpg?r=5cf","tt7808370","","6.8","2018","","This animated adaptation of the quirky four-panel comic brings the random exploits of two offbeat schoolgirls named Popuko and Pipimi to life.","Pop Team Epic","series","2020-02-01"
"81168505","18","0","https://occ-0-2851-38.1.nflxso.net/dnm/api/v6/evlCitJPPCVCry0BZlEFb5-QjKc/AAAABURpO9ZylSA4NpArgBlK5_MQ7kqXN8FVBjVTUCw5TMhEhviaU6NFd-5SFX39NzIM1WHTTxKG7plnD9cf9iLJaoUbul0FHZQdmrqs2eD7Qc4h_A70NBlhh9OZoZw.jpg?r=101","","","","2020","59m","This look behind the scenes shows how worldwide camera crews climbed, dived and froze to capture the documentary&#39;s groundbreaking night footage.","Night on Earth: Shot in the Dark","movie","2020-02-01"
"80220033","18","0","https://occ-0-768-769.1.nflxso.net/dnm/api/v6/evlCitJPPCVCry0BZlEFb5-QjKc/AAAABZcGl_ggYIINJ8vIirl3wGct9yFjelk57W7--jlC1Mw_7biuBLeAYNbZ_O6mPM1EyPud5O1fDHe2du2kQd2E1GHNWA.jpg?r=fd4","","","","2018","","A detective and a crime-family heir return to Brabant on tragic family matters that pull them into their hometown&#39;s grim underworld and drug war.","Fenix","series","2020-02-01"
"81234400","18","0","https://occ-0-2851-38.1.nflxso.net/dnm/api/v6/evlCitJPPCVCry0BZlEFb5-QjKc/AAAABSIdiv9MgHvIIwLLYbeiunvvwSdjv0gBRpuYKoCxUh-dObMcD8uEiWuDw3FH498kQaFccE7VScDuLMaZRCeiqwYJnw.jpg?r=be8","","","","2018","","Love is just a game for a chaebol heir who agrees to a petty bet with his friends to seduce a college student &mdash; until he starts to fall for her.","Tempted","series","2020-02-01"
"81234382","18","0","https://occ-0-2851-38.1.nflxso.net/dnm/api/v6/evlCitJPPCVCry0BZlEFb5-QjKc/AAAABYrqgwP8XAbRuF9zkc506FiM7MvjL9_-MUFysqHSvFoiYkBYZ_ke_HVeB_ym9yAZ577BVBFfNyya6R6x4WdhyhEQtQ.jpg?r=17e","tt10826102","https://occ-0-1007-2705.1.nflxso.net/dnm/api/v6/evlCitJPPCVCry0BZlEFb5-QjKc/AAAABRqLiV8OQ6vrHuhCsJmRrawru5jUnrhbjkhleej4ZXfy-S5_vZWU4AXMGZrU8PLNcod-Q2a1vwePJN7jxmprn8cH-kUw.jpg?r=17e","8.1","2019","","A teen seeks to change the fate that&#39;s been set for her after gaining awareness that she&#39;s just a side character in a made-up world.","Extraordinary You","series","2020-02-01"
"80017529","18","0","https://occ-0-2773-2774.1.nflxso.net/dnm/api/v6/evlCitJPPCVCry0BZlEFb5-QjKc/AAAABbCkI5EpNriAQKrJ8DIvztS2kXlbyqToiHBcVnTasLElGZSKxUtg5CNobZ9YYCXQ0U0YujPtJRhelK-Y4_6lYoD6Ew.jpg?r=a09","tt1390411","","6.9","2015","2h1m","In this true tale (which inspired &#39;Moby Dick&#39;), a New England whaling crew wages a desperate battle to survive when a giant whale capsizes their ship.","In the Heart of the Sea","movie","2020-02-02"
"81218137","18","0","https://occ-0-2851-38.1.nflxso.net/dnm/api/v6/evlCitJPPCVCry0BZlEFb5-QjKc/AAAABcBMI1TnbNR7Px1IZpbTl2RqanRhZeBr_K_eMPvpyuGjf_ghQboW6wPqZaW-UxPtFPWCCA-BdBCUaoDPUTT94Ue-_w.jpg?r=6e1","tt11642302","","5.2","2020","1h29m","This pawesome documentary explores how our feline friends became online icons, from the earliest text memes to the rise of celebrity cat influencers.","#cats_the_mewvie","movie","2020-02-05"
"80990341","18","0","https://occ-0-2851-38.1.nflxso.net/dnm/api/v6/evlCitJPPCVCry0BZlEFb5-QjKc/AAAABe3qcTGXoqXO2Cpf5cSBD661Qa5HmnbMCAmRxcLeAViTGGZgJxsoO8d81eZMhhzEq1zNNdYo8-UjMGmCxDFIJG4_hJWyR_juk3jzDGU0Jl84NjgecO-0Xs4HU00.jpg?r=442","","https://occ-0-1007-2705.1.nflxso.net/dnm/api/v6/evlCitJPPCVCry0BZlEFb5-QjKc/AAAABd3TegHMjuVx9cDUAyFLWj5ruuOUtIoYaulGtrRXjgwq8VZLQ2M5KhTlZ0_j8Ypxm-GMMmVbdKCvTdYqizLSZ1t1-8NijuwLTSC4rCgIVXZhEzjk0S97PtimUVHlQQ.jpg?r=442","","2020","1h37m","On the eve of Grandma&#39;s wedding to much-younger gardener Julio, their very different families meet up for a weekend of lies, drama and culture clashes.","Grandma&#39;s Wedding","movie","2020-02-06"
"81002576","18","0","https://occ-0-2851-38.1.nflxso.net/dnm/api/v6/evlCitJPPCVCry0BZlEFb5-QjKc/AAAABVujopXat41g1sB5ZMCI2QEU3bt1ozT1ncqNtaCdRh8N2WahNxS5novCylnzBZwD0XZhpBvM3NAGukMIlK8XugtIswmAaTO31PH6yg1NAPRyu_MCu4lp7a79v2c.jpg?r=8de","tt11600174","","7.9","2020","","After his son&#39;s tragic death, a Louisiana pharmacist goes to extremes to expose the rampant corruption behind the opioid addiction crisis.","The Pharmacist","series","2020-02-06"
"80220692","18","0","https://occ-0-2851-38.1.nflxso.net/dnm/api/v6/evlCitJPPCVCry0BZlEFb5-QjKc/AAAABZgHA4wTJMswOUAoYEh1_uikGRiPG231lHqIazYz_hMsnfO2OAnbiRlwIljDcaUVzpUuRd97tqyqIojMcpx8oZ4eDw.jpg?r=053","tt7431768","https://occ-0-58-2773.1.nflxso.net/dnm/api/v6/evlCitJPPCVCry0BZlEFb5-QjKc/AAAABSRPvRdsTR00lp8qBDyQ8okzn4dA5dq7wjiYq_9kseLNAYaEw_7jSC849A19LRkYGx0Xcq7HIaYgxhNozciu-P20WlDK.jpg?r=d93","7.1","2017","","In an otherworldly river town, a policeman follows the trail of a sinister force to save his community from deadly spells.","Tientsin Mystic","series","2020-02-06"
"70111504","18","1","http://occ-0-2851-38.1.nflxso.net/dnm/api/v6/evlCitJPPCVCry0BZlEFb5-QjKc/AAAABWahwjzBfU0AoCqCtM_Mgi0IznhGlI_3nUAnrgO0pCH-cRYSfFTz_faJ_WJu66kj0OM8hR51xazLQo4vglA3_hl3QA.jpg?r=326","tt1420554","http://cdn1.nflximg.net/images/6960/8056960.jpg","7.7","2009","1h1m","Stand-up comedy star Kevin Hart delivers his unique perspective on work, race, family and friends with this laugh-riot comedy show.","Kevin Hart: I&#39;m a Grown Little Man","movie","2020-02-06"
"81229200","18","0","https://occ-0-2773-2774.1.nflxso.net/dnm/api/v6/evlCitJPPCVCry0BZlEFb5-QjKc/AAAABcK8_C2fy3RjFKC1Wa29mvYDh-qceBcwQSo8uKHT9wYTZhOavuhc5IGq0d3G1oEKZG5-qDVv-DGO6aBSIrIoFzmEwQ.jpg?r=9d4","tt8630282","","5.8","2018","1h29m","Sent away to evade an arranged marriage, a 14-year-old begins a harrowing journey of sex work and poverty in the slums of Accra.","Azali","movie","2020-02-07"
"81025018","18","0","https://occ-0-768-769.1.nflxso.net/dnm/api/v6/evlCitJPPCVCry0BZlEFb5-QjKc/AAAABaBst9cHKnLWt1zrDMO9l8be5dF7DsYxE4oGNsQL8ASxSGHLbZ_E2z5EKpYijRrf16sJW1MaI1Iup61fg_FSvBp6AQ.jpg?r=06a","","","","2019","2h7m","During WWI, when captors force a jailed tank commander and a team of his fellow inmates to lead a training exercise, they plan a daring escape instead.","T-34","movie","2020-02-07"
"81164115","18","0","https://occ-0-2851-38.1.nflxso.net/dnm/api/v6/evlCitJPPCVCry0BZlEFb5-QjKc/AAAABZacfZBD6WPp6IedSJas6ONotVUiVAjddNzyVFQ_7u4vlX25tYkWBTo9MjPJEIe2b__TaCvBFsIizReSQh67nNFv0Q.jpg?r=cb4","","https://occ-0-1007-2705.1.nflxso.net/dnm/api/v6/evlCitJPPCVCry0BZlEFb5-QjKc/AAAABWPQY5H0h3pF5gMg7MKt3bV7MG7Wyyr5SS-e31N-cFQK8qb_M1Y_09qapcQkjFvpVEKx1hk7FHj5PhUVwZ2MZNxEOdGJ.jpg?r=cb4","","2018","","Juggling careers and families, four ambitious women faced with unique crises weigh the consequences of their choices as they approach turning 50.","Fifty: The Series","series","2020-02-07"
"80224581","18","0","https://occ-0-2773-2774.1.nflxso.net/dnm/api/v6/evlCitJPPCVCry0BZlEFb5-QjKc/AAAABUeEBm10-4O4CSckkc25NuKitn69kyFAphPUUYh6oCYUIZEqswrIJFVGcD8C-wFx3AFvknMQ4Fc_KmJXeagHsWG-D4GSIM8ygA1XYB9MiFDcuCeF5VvYejLG0-o.jpg?r=1b5","","https://occ-0-1007-2705.1.nflxso.net/dnm/api/v6/evlCitJPPCVCry0BZlEFb5-QjKc/AAAABYbZBDZ-6zkq_SwX16kbFO-ElbmjbWt0EqWj0U5x0oVpY7gUFNFqIaBBs-hq1EfN0cI5y7ETTfSfd-8iuj8i43zrhuhn8tNCAou0tcn0f_J35dq3An_JI8y74-P7KQ.jpg?r=1b5","","2020","","Thirty years after a disease that turns the infected into carnivorous insects emerged, a young exterminator and a teenage girl search for her mother.","Cagaster of an Insect Cage","series","2020-02-07"
"81103777","18","0","http://occ-0-2851-38.1.nflxso.net/dnm/api/v6/evlCitJPPCVCry0BZlEFb5-QjKc/AAAABZXRDeNUntk_ajdVuvhArUjyMwhcnTAjDIFfHRK5uF_03N3Q5079Ewo2CLSMEf2uPmGr2Q_58oWCeUAV4agF5KTxAembmyF7mBvjZ3kfYW0JAOM-jDVmi_qBmkw.jpg?r=f8b","","","","2020","1h0m","Comedian Tom Papa takes on body image issues, social media, pets, Staten Island, the &#39;old days&#39; and more in a special from his home state of New Jersey.","Tom Papa: You&#39;re Doing Great!","movie","2020-02-07"
"80057298","18","0","https://occ-0-768-769.1.nflxso.net/dnm/api/v6/evlCitJPPCVCry0BZlEFb5-QjKc/AAAABft2VipyKJl07hC19PxA1jTbYtQnnMH7XFLGLbCIy3CScX56Ma29xScJZdRumvajWftNmz9pi6UfSx38ymTLrRb00A.jpg?r=318","tt3707106","","5.3","2015","2h2m","Troubled by the state of their marriage, Vanessa and Roland visit a French seaside town, where they have a fateful encounter with a pair of newlyweds.","By the Sea","movie","2020-02-08"
"81060149","18","0","https://occ-0-2717-360.1.nflxso.net/dnm/api/v6/evlCitJPPCVCry0BZlEFb5-QjKc/AAAABbUXgOxrua8C9Mbm59Vyi9C7nkHAJ1BqkeOiz36M9zFhwp67uj0hmC-UU00sJMEB8Z_MV1Qhklc-c3h2uwKSO4hJNdHGqdpLOJNtyGYtvYmrt9UJ3seTdMIWM0c.jpg?r=685","tt11388406","","5.9","2020","1h44m","A sweet misfit with a fondness for crafts, horses and supernatural crime shows finds her increasingly lucid dreams trickling into her waking life.","Horse Girl","movie","2020-02-08"
"80211726","18","0","https://occ-0-2773-2774.1.nflxso.net/dnm/api/v6/evlCitJPPCVCry0BZlEFb5-QjKc/AAAABd-xqhqLIVj2iGOYfJDH6OtxcFvCUTUXQOKvBhLJcti-BlmnggCOeRCrwIOkjH5RtXvTeh0lb-Wop8mYIuv2oKKpeA.jpg?r=ae5","tt1677720","https://occ-0-753-1360.1.nflxso.net/dnm/api/v6/evlCitJPPCVCry0BZlEFb5-QjKc/AAAABVJGJmyJnXhUMmzxKwJBuEVEUDiL68DuCMWCbaVRyVYcPuUWcL9eC8vI2u3185FO7Qq0KbOSlzA_FV87R62vngU7wrmB.jpg?r=ae5","7.5","2018","2h19m","In a world on the brink of collapse, a talented gamer takes the lead in a series of challenges to win ownership of a massive virtual reality universe.","Ready Player One","movie","2020-02-08"
"80049358","18","0","https://occ-0-768-769.1.nflxso.net/dnm/api/v6/evlCitJPPCVCry0BZlEFb5-QjKc/AAAABSQ8_OyeKMx1Ck0qTHprUQFzLxX-gizKnvvYqZlJyfOP4EmdTOcrN_zwn7GKLh2Gya77_li4CtLPTlkYZirWBRCxiw.jpg?r=2f5","tt2080374","https://occ-0-1091-299.1.nflxso.net/dnm/api/v6/evlCitJPPCVCry0BZlEFb5-QjKc/AAAABWIo0hEOvs57nhB7L-x-GAZhTr-_ba8qe9iKfzMPT6KNYR8MtdpTw-GsdsYsSZNkFOVWcs0_U1enxQUa_3mnC_CVe6B1.jpg?r=184","7.2","2015","2h2m","By keying in on three crucial points in his career, this biopic shows the human foibles and visionary fearlessness of the man who made the Mac.","Steve Jobs","movie","2020-02-08"
"80223080","18","0","https://occ-0-2773-2774.1.nflxso.net/dnm/api/v6/evlCitJPPCVCry0BZlEFb5-QjKc/AAAABQsPA43XeA--qENHAg0Sj--yOvb9do88jOluj1ykg3iMZ7eVqTNqg4R81MEQlBcCv0ZkdhYXaPNM_kkV4Rvdzc9ptw.jpg?r=28a","tt6802308","https://occ-0-1007-2705.1.nflxso.net/dnm/api/v6/evlCitJPPCVCry0BZlEFb5-QjKc/AAAABQjbf1vkY6yNW6GIKoFlJgQWmx4jOheqdZjCBYJe8jUpvqzzXKlEW4jL0TTOfr-1TMXDiHoiYD8jEp-SGFe1rJmm6kq6.jpg?r=28a","5.2","2018","1h33m","Three American buddies on vacation in Europe leap into action when a terrorist attacks passengers on a Paris-bound train. Based on true events.","The 15:17 to Paris","movie","2020-02-08"
"81008021","18","0","https://occ-0-2851-38.1.nflxso.net/dnm/api/v6/evlCitJPPCVCry0BZlEFb5-QjKc/AAAABRi-34J8fi9nw2HL9ul0tbyCc9QBwCnBzlzTBc3W1bwgh_wvK0q-dpOb5zz0sv_7x_Aaf00f_qpib9GtGVPY37LVgzHg1xTjdb3QsUC46M_pW4y1h7uggMfr774.jpg?r=cf0","tt11058644","https://occ-0-1007-2705.1.nflxso.net/dnm/api/v6/evlCitJPPCVCry0BZlEFb5-QjKc/AAAABdOYmOo7gPB-i3azUpiycXgLdxixTvOv_mRDcqS3iccGxoEXstgw2zn_0-kXWBcs-NF6eIqKcmKyY-NoCrZICosAU8S4UhL1_Osy0fAvj-K4LuXP8iCrSsw4UZV3jw.jpg?r=cf0","0","2020","","Unexpected love finds a lonely woman when she forms a connection with a humanlike hologram who looks exactly like his prickly creator.","My Holo Love","series","2020-02-08"
"80217478","18","0","https://occ-0-2851-38.1.nflxso.net/dnm/api/v6/evlCitJPPCVCry0BZlEFb5-QjKc/AAAABceROCB9N1Y3lICZu9zo7fm6704qLm4lEXwoeGMjbFyOXePopQJpOWv_icWA79fKApmG_Isu_JWtKMKeXa7tay3vAaST7pKmUqDn890eYO-dwHuNu8WGjL2BNfo.jpg?r=db7","","","","2020","","Decades after the assassination of African American leader Malcolm X, an activist embarks on a complex mission seeking truth in the name of justice.","Who Killed Malcolm X?","series","2020-02-08"
"80241239","18","0","https://occ-0-2851-38.1.nflxso.net/dnm/api/v6/evlCitJPPCVCry0BZlEFb5-QjKc/AAAABVR1IFjRpxC7MNNZXLhgCdECchLLIbY_rQTfjGoZnqETPuiyLxrOfxrS1pP5Qv_TZVhuMr_jNKzuPihY-0oIxusORFxcBrr1hB1IE0sbJt-7X1vRwkXuCR-ykwQ.jpg?r=b18","","","","2020","","After their dad&#39;s murder, three siblings move with their mom to his ancestral estate, where they discover magical keys that unlock powers &mdash; and secrets.","Locke and Key","series","2020-02-08"
"81038345","18","0","https://occ-0-768-769.1.nflxso.net/dnm/api/v6/evlCitJPPCVCry0BZlEFb5-QjKc/AAAABSewQKBSK1QOfRUvXa7o1NYjDRbrkOzXw82P6Swvc7Be5wu4oYyqTAVFp9X3GoPvUvH4yhOAyZQi0h4uQokigMvX-g.jpg?r=ca6","","","0","2019","1h42m","After moving into their Napa Valley dream house, a couple realizes that the strange seller isn&rsquo;t quite as motivated to move on.","The Intruder","movie","2020-02-09"
"81221170","18","0","https://occ-0-2851-38.1.nflxso.net/dnm/api/v6/evlCitJPPCVCry0BZlEFb5-QjKc/AAAABZoriylqzYiIRMztyCJiLUIKbdiQCBVQW3e8VDITWxQWoB6zk40IVxw3ihswbmt0MoGktJAyrRb8p7dYHIebnN2y3AMnb__HfIxdLXjTUhLVm7bE6GomzMP4clY.jpg?r=012","tt6445414","https://occ-0-1007-2705.1.nflxso.net/dnm/api/v6/evlCitJPPCVCry0BZlEFb5-QjKc/AAAABaDq3suukxW_KvRMrkvyfsYrpneAu6dLX63w28KHbTyGrr1xg2ySq5FHR029QWhJ1B2vqZwnFa8qrKQwTAQK8GOA2biQQzXhV9UjQyMK4S245IcbDCrJ2uuUwUWh4g.jpg?r=012","6.2","2019","1h43m","During 1962&rsquo;s Cuban missile crisis, a troubled math genius finds himself drafted to play in a U.S.-Soviet chess match -- and a deadly game of espionage.","The Coldest Game","movie","2020-02-09"
"81231382","18","0","https://occ-0-2717-360.1.nflxso.net/dnm/api/v6/evlCitJPPCVCry0BZlEFb5-QjKc/AAAABYC5mdpqbz6uf4JWy728oLl5UHn1XxJ7XrX5vi4eKz2uZrv3Yt3UvJH2L_BV1JONM1bUdNaE1iX_pLwuKgfnzT--NA.jpg?r=375","tt10643938","","0","2019","1h35m","Exhausted with his mother&rsquo;s failed attempts at setting him up with women, Ican hires an ideal partner from a matchmaking app.","Love for Sale 2","movie","2020-02-10"
"81167570","18","0","https://occ-0-2851-38.1.nflxso.net/dnm/api/v6/evlCitJPPCVCry0BZlEFb5-QjKc/AAAABST9hXB59S9wyqPOXEYv7w19E_OAx_I0e2_w0vDIWqCew2tJ0p28oBPq_YoYGSlDtCGqpR9gRGRzEDLpFAPfZA9hWw.jpg?r=495","tt10367818","https://occ-0-1091-299.1.nflxso.net/dnm/api/v6/evlCitJPPCVCry0BZlEFb5-QjKc/AAAABb4xaMQhudZr1RybriZDGKYpO5yx0ynbJlIhfnxPdJZ9bzik7wjPx9PgYHWY4DLDweCjcZr4ilJI2b0Aei52Vywb3k_E.jpg?r=e92","5.5","2019","","In Colombia, the DEA&#39;s new director targets a gang of dealers pushing a powerful drug while contending with an enemy who possesses a deep network.","El final del para&iacute;so","series","2020-02-10"
"81088734","18","0","https://occ-0-768-769.1.nflxso.net/dnm/api/v6/evlCitJPPCVCry0BZlEFb5-QjKc/AAAABXmYnN_LrCLy3ACFx8vMosq0_uE2lgtAnDJRAJtAJt4y30P41ZNKjL7CHeZjG5Ef2iGCy-wQtZO3c9qmaHj9uAMKRA.jpg?r=c6d","tt5932728","","7.3","2019","2h4m","While working on the first Oxford English Dictionary, a scholar receives thousands of entries from a doctor with a lengthy vocabulary and dark secrets.","The Professor and the Madman","movie","2020-02-11"
"81228866","18","0","https://occ-0-2851-38.1.nflxso.net/dnm/api/v6/evlCitJPPCVCry0BZlEFb5-QjKc/AAAABTADsTs5dKNfIpL7hHbFOLjnDVugCMXjqkP0TYiy638YWCEK1AsVmwUUENskMCIgmLvhn8-i74-dd5NsUjv8mK3GZw.jpg?r=c1d","tt5000984","","5.5","2015","1h26m","With only her mother&#39;s diary and a locket as clues, a South African woman travels to Paris in search of the long-lost sibling she never knew she had.","French Toast","movie","2020-02-12"
"60035870","18","1","https://occ-0-2851-38.1.nflxso.net/dnm/api/v6/evlCitJPPCVCry0BZlEFb5-QjKc/AAAABXfwtRq4eyhBzYHJOx2_P2iLL7Jz6cRWKtmDLXVJXtJDedxoIbW7Dkb_a-34eptp6gSOD5v12yMbPI8oOWuXE_QYEA.jpg?r=4f1","tt0110076","http://cdn1.nflximg.net/images/0501/12040501.jpg","7.5","1994","3h13m","Prem is a budding businessman being tutored by his elder brother, Rajesh. Nisha is the carefree favorite of her elder sister Pooja. Although it&#39;s love at first sight for Prem and Nisha, they decide to sacrifice their happiness for their...","Hum Aapke Hain Koun","movie","2020-02-12"
"81085934","18","0","https://occ-0-2851-38.1.nflxso.net/dnm/api/v6/evlCitJPPCVCry0BZlEFb5-QjKc/AAAABZ6O9WdIE1CyfW2RCa2eB0Fws94SXENS6UeImpzl-XJZJ-GHOpCjwIQGNSHeb1rFlWTAjwpJhafd6a83iui-m_XFKfpaGQLF69fbr1KEzX3PDqega6DpQfa2Sgc.jpg?r=81a","","","","2020","1h12m","Director Alfonso Cuar&oacute;n reflects on the childhood memories, period details and creative choices that shaped his Academy Award-winning film &#39;ROMA.&#39;","ROAD TO ROMA","movie","2020-02-12"
"81019938","18","0","https://occ-0-2717-360.1.nflxso.net/dnm/api/v6/evlCitJPPCVCry0BZlEFb5-QjKc/AAAABZf1bqXN8_hPiGXoPlMl83WiWzV2fgNOIBTgQNTtk8_k2mMvHARxGMFbnSsPjsX3x7i0-RalJdUyE6ErAub7-5sCwYQ-YIqgQ2I0SRZoh8t_ksJXZrnsNAE0TNxPlTD1_uGmbzbWm7BsIehTME7aqQw_1KS7cDJZEPxRTku_ljQv2f2bCY21Tg.jpg?r=ac6","tt11604750","","0","2020","1h20m","In this interactive special, Harold and George need your decision-making skills to stop Krupp from blowing their beloved treehouse to smithereens.","Captain Underpants Epic Choice-o-Rama","movie","2020-02-12"
"81030842","18","0","https://occ-0-2851-38.1.nflxso.net/dnm/api/v6/evlCitJPPCVCry0BZlEFb5-QjKc/AAAABd9ZQRm_nsHB-bBAS7Gv2mhp7Fc3PSD8HWRHZsEzdYo0Kxy_Uj0D_rF9CnGhEU0IZp7JdQSEGDs3lB98GfSnMeVTMoIcFNXuxT0BhuYlLRvbzb065K5GwkJkPdM.jpg?r=6d2","tt9354842","","6.1","2020","1h42m","Lara Jean is officially Peter&rsquo;s girlfriend, so everything should be perfect, right? But feelings grow complicated when an old crush reenters her life.","To All the Boys: P.S. I Still Love You","movie","2020-02-13"
"80241963","18","0","https://occ-0-2851-38.1.nflxso.net/dnm/api/v6/evlCitJPPCVCry0BZlEFb5-QjKc/AAAABToS4y2vLk6c-VRGUoQIga3JqPHpyTU_NPdUgSGcDFbk-K1qvTl2377xQkoJAoETTxiAGjZQS87Wmn4_qtf5aadRIw.jpg?r=f80","","","","2019","","Haunted by recurring visions, a young woman with insomnia visits an old home to solve a mystery and put her nightmares to an end.","Sleepless Society: Insomnia","series","2020-02-13"
"81219405","18","0","https://occ-0-2851-38.1.nflxso.net/dnm/api/v6/evlCitJPPCVCry0BZlEFb5-QjKc/AAAABdw0lMoRnyJNC-zNS81HT6MxFXxRTZXHv0lLkY7hU7seVYXVWlj4PbF9OJqmNizUTJpJPcR5CkwmMBsztmMQasFpEw.jpg?r=6b9","tt1808262","","6.6","2010","1h57m","An adventure-loving young woman catches the attention of a handsome beau in this musical celebration of love, friends and fate.","Liefling","movie","2020-02-14"
"70058028","18","1","https://occ-0-2851-38.1.nflxso.net/dnm/api/v6/evlCitJPPCVCry0BZlEFb5-QjKc/AAAABYgxCSfRB-9OH7vZM-2gnRjprvg8JCLJHRkIkBYIzg1kDms3xOkRZ1RnRu4cnxPlZLN4ZuZS1px2mqk-t0cdvXvptQ.jpg?r=3d4","tt0762107","https://occ-0-2218-2219.1.nflxso.net/dnm/api/v6/evlCitJPPCVCry0BZlEFb5-QjKc/AAAABdCd_TeY7tHLxxNzmALDujxsXjmQF7oCnw429Lsg_nDj0sHRaZY7gMeUSGnR9MevMigbFFjs7942A16xjX8s4wmlPj3B.jpg?r=3d4","5.9","2007","1h55m","When widower Larry asks Chuck to pose as his gay lover so that he can get domestic partner benefits for his kids, his loyal buddy agrees.","I Now Pronounce You Chuck and Larry","movie","2020-02-14"
"81232964","18","0","https://occ-0-2717-360.1.nflxso.net/dnm/api/v6/evlCitJPPCVCry0BZlEFb5-QjKc/AAAABUZn9FACXeR7aTttArzufgRJ7X-hTb-1G03TtGAGMa0EbPG-r7CvJX3gl6tYZ3lT8oqfJ6EuS-hvyTAYlwfd1ZF3ZQ.jpg?r=5c7","tt7786346","","6.5","2017","32m","As a son deals with his own struggles, he must calm his father&#39;s obsession with fishing before his outlandish behavior ruins the entire family.","Fanatyk","movie","2020-02-14"
"81227047","18","0","https://occ-0-2851-38.1.nflxso.net/dnm/api/v6/evlCitJPPCVCry0BZlEFb5-QjKc/AAAABWwnxlXjx_1EnVqJDxVZrvd8Rj575r5yn43Q0Gmr2XcVoAszzzDZ89-dYswqFYMVn5i7r8hKa5xX8qdlVXrv18FkjQ.jpg?r=892","","","","2019","2h50m","In 18th-century India, a Maratha commander leads his army in preparation for a fierce battle against Afghan invaders in this film based on real events.","Panipat - The Great Betrayal","movie","2020-02-14"
"81210763","18","0","https://occ-0-2851-38.1.nflxso.net/dnm/api/v6/evlCitJPPCVCry0BZlEFb5-QjKc/AAAABXyYWd-WKRDLujQ8fuNxm5Bqz3WergUO0oxXy0Oatq4vH72uGv2R3WmgJgZhSiqbHmgRinECExn4E-RfQTTo6VmSWw.jpg?r=dd6","tt10896172","","7.2","2019","1h35m","When a seasoned sex worker sleeps with a rookie call boy, they soon find that a strictly physical relationship doesn&#39;t completely satisfy them.","Cuddle Weather","movie","2020-02-14"
"70000794","18","1","https://occ-0-2851-38.1.nflxso.net/dnm/api/v6/evlCitJPPCVCry0BZlEFb5-QjKc/AAAABXoN8V_sPDWKUJA29hp1kaLFAmpS3ohE_N3w80M8tmYG-1WxzwgTYysoWb25OXrfKhzs3sSobEXwtWZHrScQwobIhQ.jpg?r=c0c","tt0116483","https://occ-0-114-116.1.nflxso.net/dnm/api/v6/evlCitJPPCVCry0BZlEFb5-QjKc/AAAABVpWPqxiNY3Gxwou1PDxYs4YC_fx5z_LntsrHNw2yxxYL82RWKeilj3zjppXgJNRi7hr5tG2j89TKoLP6Su0l9dBEkiJ.jpg?r=c0c","7","1996","1h31m","A failed hockey player turned unconventional golf whiz is determined to win a PGA tournament to save his grandmother&#39;s house with the prize money.","Happy Gilmore","movie","2020-02-14"
"70045274","18","1","https://occ-0-2773-2774.1.nflxso.net/dnm/api/v6/evlCitJPPCVCry0BZlEFb5-QjKc/AAAABddSB-aalCvyw3DsPKWOANABMdxN7w9cu5_tQFwRa4VeMMkMU-HBBVth6RqI06z7msAf9paovXw9HXwZn-6-JWSgAA.jpg?r=ea0","tt0413099","https://occ-0-2774-2773.1.nflxso.net/dnm/api/v6/evlCitJPPCVCry0BZlEFb5-QjKc/AAAABflcSKbhwO_jI_AVBRDqc9E_4lPFAcaFqbrH1NNYn0G0gWBRpoCpmIbDGMB3QYbAHIeFapFaFKth9BrQXr-nKboEfjI8.jpg?r=ea0","5.4","2006","1h35m","God summons narcissistic Evan to build an ark in preparation for a flood. Meanwhile, Evan&#39;s family interprets his new hobby as a midlife crisis.","Evan Almighty","movie","2020-02-14"
"81170086","18","0","https://occ-0-2851-38.1.nflxso.net/dnm/api/v6/evlCitJPPCVCry0BZlEFb5-QjKc/AAAABd61KRJf6al-o6h5jok3VUBGHY2DW8bLGuxY_G4Q08RWfbLJOzfrziNOlOo8koCRIXpvxK_R8oEoluHcCl4aNnv_dCbWWtifq5zh1MOKmdrHG2h4fMsVzSN696g.jpg?r=9a6","tt10127562","","6.6","2019","1h42m","Luca follows in his father&#39;s footsteps to rescue his mother from evil Ladja. Finding the heavenly hero who wields the Zenithian sword is his only hope.","Dragon Quest Your Story","movie","2020-02-14"
"60034545","18","1","https://occ-0-2851-38.1.nflxso.net/dnm/api/v6/evlCitJPPCVCry0BZlEFb5-QjKc/AAAABbN2ebfdLwEFr3S0bk4dFPjKn2jU6TNw4Dy3B90v7noHhaE1b-3DhlNkwDQrlPKXAcf0C3JuQzCu59t_OGTdTlwrQQ.jpg?r=136","tt0338013","https://occ-0-784-778.1.nflxso.net/dnm/api/v6/evlCitJPPCVCry0BZlEFb5-QjKc/AAAABcPOzrCApatRCmiZdzKS4XHSR5HkTTYj_TQ0b9NTlPhdnBTD1TOt3D7uSz7YXDU1QWtVDf_REZl50Sw8hRnNUxZEGiIC.jpg?r=90d","8.3","2004","1h43m","After learning that his ex-girlfriend had an experimental medical procedure to purge all memories of him, a man decides to do the same with her.","Eternal Sunshine of the Spotless Mind","movie","2020-02-14"
"80195901","18","0","https://occ-0-768-769.1.nflxso.net/dnm/api/v6/evlCitJPPCVCry0BZlEFb5-QjKc/AAAABSn730DAF-Fei0eyz9LyRET08ALuy4DbDpzwrv3_EAZ1VeK3cfwEVqrueHUlnQoO4s_y2LcMB8paKQUdHerYvRjvQg.jpg?r=b7d","tt6643972","https://occ-0-1091-299.1.nflxso.net/dnm/api/v6/evlCitJPPCVCry0BZlEFb5-QjKc/AAAABQIvMwudAPuabJBckv3hmAH4BhgzuK1xcr545CglkinOK9hDJoGpv67wSEPQDfH4ERyGAGnVx3A0d10ElmepAexO5Cwg.jpg?r=0d6","5.5","2019","1h36m","A crew of ruthless criminals hired to kill an influential heiress meet their match in a trio of surprisingly adept fighters who come to her aid.","Triple Threat","movie","2020-02-14"
