"NETFLIXID","COUNTRY","DOWNLOAD","IMAGE","IMDBID","LARGEIMAGE","RATING","RELEASED","RUNTIME","SYNOPSIS","TITLE","TYPE","UNOGSDATE"
"81010786","18","0","https://occ-0-2773-2774.1.nflxso.net/dnm/api/v6/evlCitJPPCVCry0BZlEFb5-QjKc/AAAABaOdv4gsZtmmHT3cgTJk93_GA6avNbFqzbXzUvSyU6CyeiGDkTJ_AyX2AYqOJjfuwVnFhG6xCirOtv7vKsJLRN38Qskb6HH6qJUE-muJSBIdAAohStXJJeGsZBs.jpg?r=ca6","","","","2019","","Four intrepid and impulsive police officers form a special narcotics unit to combat the birth of drug trafficking on Spain&#39;s Costa del Sol in the 1970s.","Drug Squad: Costa del Sol","series","2019-10-26"
"81185502","18","0","https://occ-0-2851-38.1.nflxso.net/dnm/api/v6/evlCitJPPCVCry0BZlEFb5-QjKc/AAAABbHncmDplMKfsZ4iUUxy58wPuLewNYHu0RTegTH-vYSiPgZiD_G9qec1n05ekazY4IDv4wOAfepBoyR0XX363y-3AQ.jpg?r=e30","tt11152058","","0","2019","","A shy college student with a knack for drawing develops a crush on a musically gifted classmate and embarks on a journey of self-discovery.","A Little Thing Called First Love","series","2019-10-26"
"80221210","18","0","https://occ-0-2851-38.1.nflxso.net/dnm/api/v6/evlCitJPPCVCry0BZlEFb5-QjKc/AAAABfECGZeXEhpK99V4i_bZWEid89UT36vfDpvYXpfXLjP-pKFVyr8kjEVon4jHZCu3TcsDB8KC5O5r31OvVfatyStBXjhxkDmIioafyVbwr0GyMAtfKep6FdpxhW8.jpg?r=543","tt7220118","","4.6","2019","","An honest lawyer reaches a moral crossroads after the cops force her to inform on her incarcerated brother, the leader of a rising criminal faction.","Brotherhood","series","2019-10-26"
"81062582","18","0","https://occ-0-2851-38.1.nflxso.net/dnm/api/v6/evlCitJPPCVCry0BZlEFb5-QjKc/AAAABR59Fw7xTtlstpHnT_vwN5gQixmDD7bRIv6t2mIf0iS_gDpupeRoi_V9BEnanDQYoBcKXGJ-jdvoxtSTpTfslCIhIP116C2Ewm93azvayYUkn4m3Toa1Tp3SSjg.jpg?r=b3f","","","","2019","","On this competition show, novice bakers try to avoid a fiasco while duplicating stunning sweets. At stake are a trophy and 5,000 euros.","Nailed It! Spain","series","2019-10-26"
"81061828","18","0","https://occ-0-2851-38.1.nflxso.net/dnm/api/v6/evlCitJPPCVCry0BZlEFb5-QjKc/AAAABSJeVyC_Wp9Zazn9zOsaojnYJuUH0lwzJY7evPgrZNI3AsBc_kJp0NipXHLhRW7R26tkVT7wT4sQIZgmEc1zZ8AEnqMo55Q3CTbtD-lAdnbO5C-zXCGU0hCPwXI.jpg?r=a65","","","","2019","","On this fun and funny competition show, home bakers talented in catastrophe struggle to re-create dessert masterpieces and win a 5,000 euro prize.","Nailed It! France","series","2019-10-26"
"81197399","18","0","https://occ-0-2851-38.1.nflxso.net/dnm/api/v6/evlCitJPPCVCry0BZlEFb5-QjKc/AAAABW9JzRUPV3Zu5ztaSEp9G340tU43epaqPPSuvvgYMkv7QM4xyW8M71nsiypaeu4Pr0A3RV4lhmQG8vGA99wR5zgrOQ.jpg?r=feb","","","","2019","","Six hopeful friends journey into adulthood to create the moments that pull them together, draw them apart and make them fall in love.","Wait, My Youth","series","2019-10-27"
"81001691","18","0","https://occ-0-768-769.1.nflxso.net/dnm/api/v6/evlCitJPPCVCry0BZlEFb5-QjKc/AAAABSD2mYzUePkTKKzi9mlxTWZwsz6QGfxb0APJbpq8XFnL-y2QWFLSXM5tWZhP2FR1HyV8dZn9FYZ9GgL_6Ye94-9N5Q.jpg?r=ee3","tt5886046","","6.3","2019","1h39m","Six strangers use their wits to survive a series of deadly mystery rooms that cater to their worst fears -- or die trying.","Escape Room","movie","2019-10-28"
"80244679","18","0","https://occ-0-2717-360.1.nflxso.net/dnm/api/v6/evlCitJPPCVCry0BZlEFb5-QjKc/AAAABdzcZhwS-P4TYz7trfACIxjKyiEshgBRTvMc1XXS-rw4jNV1nQtXoJDP_pQg4EnPB-6KZQ1he3GEwogJwHdb93adH3WGLmlZIdJhz5-_nD-tSVmn9AKBnd9xCwg.jpg?r=9be","tt9098586","","0","2019","28m","This documentary captures the joy and heartbreak of families separated by the U.S.-Mexico border sharing a short but bittersweet reunion in 2018.","A 3 Minute Hug","movie","2019-10-29"
"81110394","18","0","https://occ-0-2851-38.1.nflxso.net/dnm/api/v6/evlCitJPPCVCry0BZlEFb5-QjKc/AAAABXUFq8Y_ZOr2O15YtNnIBgqMDQIAnCDrU2canMd-A0YElVnWxn8JrfbaHI2zTcU4nqtG4i4fZBOi5XVVM3YWdIYZWBEdDH7oV1MIdUgHM7Gn9GHREqutp0B1mRA.jpg?r=017","tt9195844","","6.6","2018","19m","In an ancient sport traditionally reserved for men, 20-year-old female sumo prodigy Hiyori attempts to revolutionize Japan&rsquo;s national pastime.","Little Miss Sumo","movie","2019-10-29"
"80191236","18","0","https://occ-0-2851-38.1.nflxso.net/dnm/api/v6/evlCitJPPCVCry0BZlEFb5-QjKc/AAAABSTsDQKjLHKO-6U6NtYLwErV8ma5a07kOwKbxiGuJw5tFR1kzXsaKPLpejdM32ytLB-Q9uWLsQe7kLikr1eWwIipvw.jpg?r=047","tt8174886","https://occ-0-1007-2705.1.nflxso.net/dnm/api/v6/evlCitJPPCVCry0BZlEFb5-QjKc/AAAABX8mpK2jn-Nf3b7pZc-xcg32-2KzdwfvLH6hfxdlN1pIyY3Cnw9ydU8ByhScjSWg3JWitEdcEl5B2bYfDlxKiMZgQ0n9.jpg?r=047","","2018","","This series dramatizes the life story of Mexican superstar singer Luis Miguel, who has captivated audiences in Latin America and beyond for decades.","Luis Miguel - The Series","series","2019-10-29"
"81169914","18","0","https://occ-0-2851-38.1.nflxso.net/dnm/api/v6/evlCitJPPCVCry0BZlEFb5-QjKc/AAAABcRGhDjCdWlqzyMfWTkHJSXvymcgJ3YCdG-llfeScW3czJhjYxWCEdqwMQem6WDUGUmADF1vtYWbKZ9DmorLIdVHSg.jpg?r=826","tt8689470","","7.6","2018","","In a talk show straight from the heart, actor and producer Reese Witherspoon visits with groundbreaking women to discuss their inspiring journeys.","Shine On with Reese","series","2019-10-29"
"80204119","18","0","https://occ-0-2851-38.1.nflxso.net/dnm/api/v6/evlCitJPPCVCry0BZlEFb5-QjKc/AAAABX3PdObhzKlH1Jy3jptEBmojhhA8ilOuzGsemTd39KGIdfdPztKv5ImVlfvw0U5dfQvqgaXgHkxBEE3mI7rK-oXWFA.jpg?r=c70","tt2631186","","8.1","2015","2h39m","Villagers in the kingdom of Mahismati rescue a baby who is destined to embark on a heroic quest in this Malayalam version of S.S. Rajamouli&#39;s epic.","Baahubali: The Beginning (Malayalam Version)","movie","2019-10-30"
"81211714","18","0","https://occ-0-2851-38.1.nflxso.net/dnm/api/v6/evlCitJPPCVCry0BZlEFb5-QjKc/AAAABWS-XtDwT1uSnKGDGtM7645xBPaKQrZV39bYPIHhHdouz6yAfk0MgBbb3qnIygPm4SbDXqAFlRG7PlugutGRdyouq3HtOQvKxlzHm6rkjNtR88agjvBaDvXVvRE.jpg?r=867","","","","2019","13m","Aaron Paul, Vince Gilligan and other cast members, producers and crew share stories and footage from the making of &#39;El Camino.&#39;","The Road to El Camino: Behind the Scenes of El Camino: A Breaking Bad Movie","movie","2019-10-30"
"81166978","18","0","https://occ-0-2851-38.1.nflxso.net/dnm/api/v6/evlCitJPPCVCry0BZlEFb5-QjKc/AAAABRFB2h1Su6jKcuF0ayTr3ZyIblO1RitB3FY2IICf7PA4SS1gi18JezfBY2Sj4NHVElnD_J5Qen28sNzza0aALzRMLQ.jpg?r=579","tt5768840","","7.6","2016","","A college student with psychic abilities takes in an amnesiac ghost as his roommate -- who ends up helping him hunt down spooky spirits.","Bring It On, Ghost","series","2019-10-30"
"81167029","18","0","https://occ-0-2851-38.1.nflxso.net/dnm/api/v6/evlCitJPPCVCry0BZlEFb5-QjKc/AAAABa5iRcd_y1pM-Mf1a6TlkrwAAJHYZ5U11TLHc044RfnKeZ-78hIDBQ9lkeqtRvy-5W_dcf2U4DjLGq2o5cw-ZB3UeQ.jpg?r=6c6","tt5994346","","7.4","2017","","The head of a real estate firm with the ability to travel through time by taking the subway marries a photographer to try and change his future.","Tomorrow with You","series","2019-10-30"
"81142594","18","0","https://occ-0-2851-38.1.nflxso.net/dnm/api/v6/evlCitJPPCVCry0BZlEFb5-QjKc/AAAABWDHMKaaolXY3CUb6SK1lb5EG1Nzi-rIUaMCGuWNP2xu58hnAGvW9p_DcSURPYJhojq8zK91igyZCAwIP78kRjbuKA.jpg?r=86d","tt8586662","","8.6","2019","","A detective finds himself 30 years in the future and must solve a string of grisly crimes before he can return to the past.","Tunnel","series","2019-10-30"
"81148672","18","0","http://occ-0-2851-38.1.nflxso.net/dnm/api/v6/evlCitJPPCVCry0BZlEFb5-QjKc/AAAABfkxv9HK6BBhFmUfLKbR7KEh-7_UhkVxVmK4jCMtgbueELAOUh-DJBXsT337fZ3_AFO-fgdRfy5xMOeWBGGk35Du3mYUmaovwrCJfFnUO5-NYyKT6NIOOeSxs7I.jpg?r=ca4","","","","2019","1h3m","In his first stand-up special, Arsenio Hall discusses getting older, the changing times and culture, social issues and even bothersome baby toes.","Arsenio Hall: Smart and Classy","movie","2019-10-30"
"70095265","18","0","https://occ-0-2773-2774.1.nflxso.net/dnm/api/v6/evlCitJPPCVCry0BZlEFb5-QjKc/AAAABUD4c0ySHYWWdH0J9yDCiFzvSOMJwuwqq3C8fpIRaE_zY4IxMn50w6IEg-ajgBaGuu0x_SgGeSgB1QmaDsc6BDUrfw.jpg?r=ed1","tt0479647","https://occ-0-1952-2433.1.nflxso.net/dnm/api/v6/evlCitJPPCVCry0BZlEFb5-QjKc/AAAABbLCQNVtbm80Sz8qBQ3u3xMivZ3iaQi3s-EOBcI1PAIC59rwWEj6ppbZtd7wFMUEVDdWlDDGnrDV2GGlNuivPbtHQH79.jpg?r=4cf","6.8","2006","1h56m","This action comedy shows what happens when two cops with opposing ideologies -- an English-speaking officer from Toronto and a French-speaking one from Montreal -- are forced to work together to solve a crime.","Bon Cop, Bad Cop","movie","2019-10-31"
"80221242","18","0","https://occ-0-1490-1489.1.nflxso.net/dnm/api/v6/evlCitJPPCVCry0BZlEFb5-QjKc/AAAABRvzKAfh5GMzYwSZJ6sTfS1NDpuiNzAdG_B80-L8uTvoaprX1wyn4L5oxtLDjkwhYQT919EuLT4x9sRY2UaMm5KBpg.jpg?r=62f","tt1285009","https://occ-0-2773-2774.1.nflxso.net/dnm/api/v6/evlCitJPPCVCry0BZlEFb5-QjKc/AAAABbTCTr53Z7JQQFmxrwrtorr3BkrdwW8YzMgtcbPf8jeZYjuV5AY6TCzxD9kbxiSFICFhWK72hw57NkgyXF1qtZmkbreZ.jpg?r=3d7","5.2","2018","1h25m","Home-invasion horror comes to the trailer park when a family arrives at a mobile home community to find nobody there but a trio of masked murderers.","The Strangers: Prey At Night","movie","2019-10-31"
"70077542","18","0","https://occ-0-2851-38.1.nflxso.net/dnm/api/v6/evlCitJPPCVCry0BZlEFb5-QjKc/AAAABRowOeSsZ4JWwYbDM5GCw7spkJVcqPN9l1szaedmGdlxv0h4rL0byeMCdO0tPXbY-3U1VIAB3PXuTO8AoJCwb9WzNQ.jpg?r=3f1","tt0825232","https://occ-0-1007-2705.1.nflxso.net/dnm/api/v6/evlCitJPPCVCry0BZlEFb5-QjKc/AAAABRT6mUEUnw_i9KrvCzlTQnn-axfz8MkszMvTe8rFrTve4DsyqTOmR_JSJgYhAu6kz2RlAhaAiWUFXOzwma6iJqWZZaA6.jpg?r=3f1","7.4","2007","1h37m","Two terminally ill men bust out of the cancer ward with a plan to experience life to the fullest before they kick the bucket.","The Bucket List","movie","2019-10-31"
"70220029","18","1","https://occ-0-768-769.1.nflxso.net/dnm/api/v6/evlCitJPPCVCry0BZlEFb5-QjKc/AAAABaMbJP1BcJrWH52F65Ix68V2vzAbqLvv9tlge9P2Xde_lpx72n9Q6VxOAe9Ed3runDCP8E6gt-MKVObBoQh0aEJheg.jpg?r=99a","tt1855325","https://occ-0-2774-2773.1.nflxso.net/dnm/api/v6/evlCitJPPCVCry0BZlEFb5-QjKc/AAAABV88aBgXGi8nNtNiYUaw5cDs55zVIoTk78lepnJ8odG_83H4N6wBc0qMr7bgCqbzVquxY173o16AYzHrUSCykEhh4-4p.jpg?r=99a","5.4","2012","1h35m","The Umbrella Corporation&#39;s deadly T-virus is transforming ordinary people into legions of the undead, and the human race has just one hope: Alice.","Resident Evil: Retribution","movie","2019-11-01"
"207856","18","0","https://occ-0-2851-38.1.nflxso.net/dnm/api/v6/evlCitJPPCVCry0BZlEFb5-QjKc/AAAABd8H3yW84QBZ7bXkGlzSmeKjpS8gUEV7S_zPN4qVOX7mQ0SNpyHlOkh0WGGlrARjpOZPFlZXyU4t5E8phADO9rq80g.jpg?r=43c","tt0062622","https://occ-0-2774-2773.1.nflxso.net/dnm/api/v6/evlCitJPPCVCry0BZlEFb5-QjKc/AAAABbjUFYCF6qVcxBNZXhL_HIGhaNXLosDyYyg6v3WP9H1FLsGMBtJx1uy9R8pEMgz0gGzPLlcF9lgH5WjpB_jl4p6DmlDw.jpg?r=43c","8.3","1968","2h28m","While investigating the appearance of mysterious monoliths throughout the universe, two astronauts battle their ship&#39;s intelligent computer system.","2001: A Space Odyssey","movie","2019-11-01"
"81018860","18","0","https://occ-0-2773-2774.1.nflxso.net/dnm/api/v6/evlCitJPPCVCry0BZlEFb5-QjKc/AAAABQr7EXNUAK6MGvdjQt1vcU6Qv1DTq6DY2Mj7ToLTGqIYUczZDPrWHdKGifyCFSeFUSDtx-O6NUC_3w82mU_1DNYZ4g.jpg?r=5a5","tt1751105","https://occ-0-1091-299.1.nflxso.net/dnm/api/v6/evlCitJPPCVCry0BZlEFb5-QjKc/AAAABflMmA3h81GVaCAsCO5VqdvqVaaY17JM05JUSLkoHee-_IajNHekPED_HarPgMBR3VpP9mdL4s7YkPtkGyeLDWu-BQOK.jpg?r=594","7.6","2018","44m","The ponies get in the spirit of the holidays by drawing names for a gift exchange, then race around Equestria in search of the perfect presents.","My Little Pony Friendship Is Magic: Best Gift Ever","movie","2019-11-01"
"19580286","18","0","https://occ-0-768-769.1.nflxso.net/dnm/api/v6/evlCitJPPCVCry0BZlEFb5-QjKc/AAAABY6nM1kfYyNgWaOrVVGsHWDBALbpjoOcRW1Q3T-53YbKsn1ShraPrPCxGd9wQIhh7MzTpmVRFoAywp3uWk6hJgFWTg.jpg?r=d29","tt0155776","http://cdn0.nflximg.net/images/2364/3832364.jpg","5.6","1999","","In this wicked tale of catfights taken to the max, bossy Courtney convinces Marcie and Julie to kidnap Liz to keep her from becoming prom queen.","Jawbreaker","movie","2019-11-01"
"70118397","18","0","https://occ-0-2851-38.1.nflxso.net/dnm/api/v6/evlCitJPPCVCry0BZlEFb5-QjKc/AAAABaA-NGqTDK852NHzikEBvNpaZnvAux-2yKsTV-VvPa3Jgjopd9B6laKLWdG_mvazaL7Ypb3kdCPQKaOGzbqo7u1aZQ.jpg?r=483","tt1075747","https://occ-0-1091-299.1.nflxso.net/dnm/api/v6/evlCitJPPCVCry0BZlEFb5-QjKc/AAAABZUnZNZe3zvJgWXYcukp4946pvcLL5PqOMwEniALbKvXkReIOfKp20bBGCWfb3p0zJeGx_hKSF9CqcML4zY8kACb9Orw.jpg?r=ceb","4.7","2010","1h21m","Enlisted by a Union soldier, scarred bounty hunter Jonah Hex scours the Wild West in pursuit of Turnbull, a crazed voodoo master.","Jonah Hex","movie","2019-11-01"
"80993397","18","0","https://occ-0-2773-2774.1.nflxso.net/dnm/api/v6/evlCitJPPCVCry0BZlEFb5-QjKc/AAAABQxhSOgJ1xgTxTSvt7kYf0rXGtmTr77FrRT7vKMuSkUMGivHV3bqbN7KJGZ0C04UXnSHu-q27BdNZR222pQHXc1BqA.jpg?r=72d","tt5153236","https://occ-0-1926-41.1.nflxso.net/dnm/api/v6/evlCitJPPCVCry0BZlEFb5-QjKc/AAAABW9VJ4E7bIXRUFdNVi9cmxvdbByb9Wsr3mylOTO2pRrhIgoQ99gyRw9Vs5j-30AKk1Yjbj9NGdBviyzhLu2JoYww8nLo.jpg?r=860","6","2017","1h43m","An American widow in London forms an unexpected relationship with a man living off the grid in a beautiful park ripe for development.","Hampstead","movie","2019-11-01"
"60001533","18","0","https://occ-0-2773-2774.1.nflxso.net/dnm/api/v6/evlCitJPPCVCry0BZlEFb5-QjKc/AAAABc6dQ4iuLsRp2O8fbxW5a7hQgv3PX8GgaT2FigCDZRyo5W3-3FCtUJettJKu2m6elOVx6CYtU_ffbAMBxR-RyuiCdg.jpg?r=f55","tt0098384","https://occ-0-1091-299.1.nflxso.net/dnm/api/v6/evlCitJPPCVCry0BZlEFb5-QjKc/AAAABUJVRcG8L4L4OPKjApeCxrzp7CfuuJO3cWU7n6SWfZ2g5nP18Dz6J7nG_MkyiNJH7TPmL034D2Appn6pGZqMRwF9gzpQ.jpg?r=f55","7.3","1989","1h58m","In this bittersweet drama, five tight-knit women congregate at a beauty parlor in a small Louisiana town to laugh, cry and discuss their lives.","Steel Magnolias","movie","2019-11-01"
"80240972","18","0","https://occ-0-768-769.1.nflxso.net/dnm/api/v6/evlCitJPPCVCry0BZlEFb5-QjKc/AAAABUJQV4atq2dFab_W6do91oPq1mho3z9rT4cIy6rKosPhnknwVRrvisQWl4syuknBfcUJzJFSXuSZHu7HoGHn5FlaVA.jpg?r=441","tt6952960","","6.7","2018","1h37m","A devoted teacher takes interest in a young student&#39;s creative potential after hearing his poetry. But she soon crosses the line into obsession.","The Kindergarten Teacher","movie","2019-11-01"
"81172909","18","0","https://occ-0-2851-38.1.nflxso.net/dnm/api/v6/evlCitJPPCVCry0BZlEFb5-QjKc/AAAABXrOalhemB4QvJ8aFfDzwszWvbMtu34EOA632y02bxGMLdaLaH1hJVCuV5RCLgK530mQzqrf9MJxFaEXnea0ZlP-ww.jpg?r=d21","","","","2017","1h41m","Doubting her future as a nun, a woman attempts to have a child, triggering a mystic tribal prophecy that could force her to make a godly sacrifice.","Tatu","movie","2019-11-01"
"80150290","18","0","https://occ-0-2851-38.1.nflxso.net/dnm/api/v6/evlCitJPPCVCry0BZlEFb5-QjKc/AAAABbsy3fueDYsW1H8RkEN3tB-6ixsbJ9_-IrWLnnha2nvii8JXBaiIf24VYF9HBBXutSmJkvsIGOqm-z_tmvfnAjU17A.jpg?r=055","tt5344382","","7.9","2016","","On a terraformed post-disaster Mars, a group of child security agents rebel against the adults who betrayed them and the oppressive Earth government.","Mobile Suit Gundam: Iron-Blooded Orphans","series","2019-11-01"
"80203920","18","0","https://occ-0-2851-38.1.nflxso.net/dnm/api/v6/evlCitJPPCVCry0BZlEFb5-QjKc/AAAABQzeXEs7dflYl5UJaKX9QCwidy1ANDyb1XsZ5HKwfMR2IGLYPvdsGU4_yw4HEIHRQQFx2Fb1F9mfxWij63APBHifS99k50bmt_ieqyaONSuisz3z0cXWTeGsOew.jpg?r=557","tt10895588","","5.3","2019","","Two nefarious schemes taking place 10 years apart entangle a dauntless triad member, who must break out of prison to rescue a loved one.","Nowhere Man","series","2019-11-01"
"81189912","18","0","https://occ-0-2717-360.1.nflxso.net/dnm/api/v6/evlCitJPPCVCry0BZlEFb5-QjKc/AAAABVR0NeMH3R4DUjPpiX3NOoqH63rxiisTuQ6KFYcdJDviKPVrqICOHGBXLRG3Ve1PRGcfir_GiHDLzjgr392HAUBC4krzeFAnQl5TS2xGkIqIl6MA965IKuJsxdg.jpg?r=9a2","tt9165808","https://occ-0-1952-2433.1.nflxso.net/dnm/api/v6/evlCitJPPCVCry0BZlEFb5-QjKc/AAAABfJhZcYPb_RnhO-7Rbri1vGauyyf0BVZIaozTQLLHu1yOhYMoyqOKa7ln3WS3XVKb7HJWr03cFLX89xN6IYwRXANzc3hWuxS6Id6SIizLhlWSRLN573b6mr6k4l7AA.jpg?r=e87","0","2019","1h59m","A notorious thief allies with a street racer for a grand heist involving an elaborate game of deceit with authorities, who have their own dirty secrets.","Drive","movie","2019-11-02"
"81024100","18","0","https://occ-0-2851-38.1.nflxso.net/dnm/api/v6/evlCitJPPCVCry0BZlEFb5-QjKc/AAAABdtFQ73sPWU8ofxEX9_SvFlmI3lHFVeOZ10cSn7vs7SNEyZPqz5g-DyX4Ulo0wncP5nnJ4nIjpALZt_XjIbrk6kXUAkvw-THOVYWJOEuQmfGWbYeushUp-GWsvI.jpg?r=e36","tt9664078","","5.6","2019","1h30m","Time passes and tension mounts in a Florida police station as an estranged interracial couple awaits news of their missing teenage son.","American Son","movie","2019-11-02"
"80231468","18","0","https://occ-0-2717-360.1.nflxso.net/dnm/api/v6/evlCitJPPCVCry0BZlEFb5-QjKc/AAAABW6tUCRJb5F5PkPQwxlnlxrWRp3QTOD-ZJlejHonUy4Rg94UHirR_O9z0jscRzZt0SjpwE_f97RZeh0uCtvghg3pLa7A41LZkM56afell0sqf1g30Q9p6azzKhA.jpg?r=cbf","","","","2019","1h26m","When her husband abruptly ends their marriage, empty nester Kate embarks on a solo second honeymoon in Africa, finding purpose -- and potential romance.","Holiday in the Wild","movie","2019-11-02"
"81050375","18","0","https://occ-0-2851-38.1.nflxso.net/dnm/api/v6/evlCitJPPCVCry0BZlEFb5-QjKc/AAAABSDxAxPZJpG_PqAJNfaGoGbidHRk5DyFjZnHLx81Qj2RWQfhmjqBryLvaAsYFqtbdh6PqL0cahtkUS633SQZFjqTPDoVwIBJSlElhDRunr___UE1KJeJmldok60.jpg?r=90e","tt11127056","","7.4","2019","40m","In this documentary, survivors recall the catastrophic 2018 Camp Fire, which razed the town of Paradise and became California&rsquo;s deadliest wildfire.","Fire in Paradise","movie","2019-11-02"
"80245356","18","0","https://occ-0-2851-38.1.nflxso.net/dnm/api/v6/evlCitJPPCVCry0BZlEFb5-QjKc/AAAABYduioElOTYSdOFi3bW56sua4L-YENDKVoSMJJcAK0pUBxBOqEuLRlWiWfhBG5FhuWhUaVXCCV55M0RERpCzUGxFLQ.jpg?r=f59","","https://occ-0-1952-2433.1.nflxso.net/dnm/api/v6/evlCitJPPCVCry0BZlEFb5-QjKc/AAAABeXAwB-Dir4xKbRkiioGK5qwB3uzSECEZaNpI5s2bmsuNftZJdp8VwD6E3XYr8846lFcB7GlDtZBNEWg0y9Bq5_VWhyW.jpg?r=f59","","2019","1h33m","The residents of an isolated town look to revive their home&#39;s identity when a group of foreigners unexpectedly arrive, bringing culture shock with them.","A Remarkable Tale","movie","2019-11-02"
"80182016","18","0","https://occ-0-2851-38.1.nflxso.net/dnm/api/v6/evlCitJPPCVCry0BZlEFb5-QjKc/AAAABQu_V9I9M5R9i7BeBFvX7TpRDwoS5X61_9lCcayNQnsfERP93pcBuoYEHENwBjn7FcgYUCqlvW5EqbekDdFMqRRQOrYPHH0LxG6_6WQCmOkkE09Vm_NKEz52S2k.jpg?r=259","tt7984766","","7.3","2019","2h20m","Wayward Prince Hal must turn from carouser to warrior king as he faces hostilities from inside and outside the castle walls in the battle for England.","The King","movie","2019-11-02"
"81150305","18","0","https://occ-0-2851-38.1.nflxso.net/dnm/api/v6/evlCitJPPCVCry0BZlEFb5-QjKc/AAAABTavb5Nl1KYAczEGB5zm8pzZR6Z1iJtYdMTVJeOsSGcVW5ARGek_FjTnlPEthSIB898t5036rr-DbncpXNpu_HvaxyRPhAtsUvKDFgQT9u4E3D9ul6c-SRnlRFs.jpg?r=b40","tt9646240","https://occ-0-1952-2433.1.nflxso.net/dnm/api/v6/evlCitJPPCVCry0BZlEFb5-QjKc/AAAABUCI9Y3p5kH7wTBea2A2HldhXiknxIL1mT0BykNidaoF8CI22vh8xpSdkQJyJUSWQbsJjgiHU92qVqY57pgTCJVx3KKGvg_n0VrhxIeUoVGuMkxYpTnxvBxLqPKjWg.jpg?r=b40","6","2019","1h47m","A gravity-defying boy raised in seclusion matures into an extraordinary man -- and an international celebrity -- who longs for human connection.","The Man Without Gravity","movie","2019-11-02"
"81082327","18","0","https://occ-0-2773-2774.1.nflxso.net/dnm/api/v6/evlCitJPPCVCry0BZlEFb5-QjKc/AAAABXWorczheVokZe-h4PlWGrjcLAVfLJR5xBN6dJOYkOgnngpvBrVGxSb76Iy2jQjh_NDwMpfb9-beFG64f-HNmUsuXQ.jpg?r=fa5","tt8548830","https://occ-0-1091-1167.1.nflxso.net/dnm/api/v6/evlCitJPPCVCry0BZlEFb5-QjKc/AAAABZCN7YwjI6gZymZApfuEgT-pCMelD2zKuGbE_ChTZYazKTb_-Y2-IgbFUetTYoVK85e5JMWCYGeC8bxZOp0qDeuXJ5GJIJxFnzh6-07uGWwe48HXv6XMHSNxuuvRFA.jpg?r=ab4","6.4","2018","","In a future where regeneration technology lets humans live indefinitely, a cop and a troubled young woman investigate a strange wave of youth suicides.","Ad Vitam","series","2019-11-02"
"81030409","18","0","https://occ-0-2851-38.1.nflxso.net/dnm/api/v6/evlCitJPPCVCry0BZlEFb5-QjKc/AAAABXncu5Hw9JHRjPsFAmHZ7byQmO1Kw3nsqTjvHQzprloU8K8Z9RtjifhfnH8LQnzu07PG8KHYkT0uXncGfbHobnNutb1lHsxTPX_e11Kvj3DANSvyoJvV7JLx6Bc.jpg?r=52a","","","","2020","35m","The de la Mora siblings publicly mourn the death of their mother amid multiple surprises and mishaps at Virginia&#39;s funeral.","The House of Flowers Presents: The Funeral","movie","2019-11-02"
"81075744","18","0","https://occ-0-2851-38.1.nflxso.net/dnm/api/v6/evlCitJPPCVCry0BZlEFb5-QjKc/AAAABTpY_2OFuHUKaoqsCUp0lwBb-x-K9GwevNSqpIP3fF5jNacpdkb8JH5lM7j9JcQx8TnuxHgveUNczT0ATVcibg1WT1Lac_oCkPgl5xVi5TMiFwrmF1LWLA30au0.jpg?r=d92","tt10971532","","8.4","2019","","The Fab Five touch down in Tokyo to spread the joy, explore the culture, and help four Japanese men and women find the confidence to be themselves.","Queer Eye: We&#39;re in Japan!","series","2019-11-02"
"81035120","18","0","https://occ-0-2851-38.1.nflxso.net/dnm/api/v6/evlCitJPPCVCry0BZlEFb5-QjKc/AAAABYKMkRnsuHMRr6Ucoayndmz6qZVYHtAfr9MRJcd_zyM02Yb9jrCYWHt8voW2rZ5_quz8NeBXdp-gW3Uju6b7EaySulpK-vbT138IdOzRphgrPti8NOeg2YV7hLA.jpg?r=3b6","","","","2019","23m","It&#39;s Grabbleapple harvest season in the Rainbow Kingdom ... but Glummy Glooma doesn&#39;t want autumn to come. Can True and her friends save the festival?","True: Grabbleapple Harvest","movie","2019-11-02"
"80206326","18","0","https://occ-0-2851-38.1.nflxso.net/dnm/api/v6/evlCitJPPCVCry0BZlEFb5-QjKc/AAAABVTHL1aWw5voqufExTLgZVCQ7QWD71b-0rbHw21Zx7k9eN6NPKybvvpNjp1xTdhuyZsbFW0AKTdBodKfOlSWotMHwA.jpg?r=2da","tt0284735","https://occ-0-2430-2433.1.nflxso.net/dnm/api/v6/evlCitJPPCVCry0BZlEFb5-QjKc/AAAABcBG0ttD0fdxukW1d9QNXWZg-kUzTct5qXfvkzV7EOEbtpGAOStGSK_iNMtk1ymSI2TanV1jacsIoeUHuBamthdNrcgc.jpg?r=2da","8.2","1986","","Buckle up for a head-to-toe adventure through the human body as this animated series explores the workings of our cells, hearts, brains and more.","Once Upon a Time... Life","series","2019-11-02"
"80227818","18","0","https://occ-0-2851-38.1.nflxso.net/dnm/api/v6/evlCitJPPCVCry0BZlEFb5-QjKc/AAAABcTcM_eujbkCidhQgmYvyNk_ifZ-beFHYYE8emn7Xw9CFQY0tfDcRrAyvELSoLmgcVS2-uF1ehS8EzCHEp_pTqBZ--Rf6PwK1WDxXFsgVsKy4no4eymBPb7buDbFvCES5LkpoeJUyzhptEU5CXRiqsuX2aGT.jpg?r=770","","","","2019","","BFFs Wesley and Georgie and their silly cat sidekick Pretzel transform into ninjas and enter a magic world, where they solve problems and save the day.","Hello Ninja","series","2019-11-02"
"80241387","18","0","https://occ-0-2851-38.1.nflxso.net/dnm/api/v6/evlCitJPPCVCry0BZlEFb5-QjKc/AAAABYqzCCE6pomh30A5MJml2OFl7zDyOlmvY97Erc6l23yIN-2ukD8oYiNI7QgI_abx_ffRWiEHnYFWKC26xYi1sAggFD-hSWW7bcKe82bt5xcT9Riam-awgYrV0zY.jpg?r=779","tt8575476","","6.2","2019","","As Helena gains the love and trust of a dangerous heroin cartel leader in 1960s Barcelona, she hones the skills she needs to rise up the ranks.","Hache","series","2019-11-02"
"70177040","18","1","https://occ-0-2851-38.1.nflxso.net/dnm/api/v6/evlCitJPPCVCry0BZlEFb5-QjKc/AAAABTVzT2YyROVK1OibdGfMMrFXjO1Ije1_fEggsY42dkvJGoTPh7EnyP2gn10df3WGQ9HhV0uIzPpBrFlXFOnOx448Ng.jpg?r=c18","tt0081848","http://cdn1.nflximg.net/images/0451/21110451.jpg","7.4","1981","","Follow the adventures of superspy Danger Mouse and his bumbling sidekick, Penfold, as they jet around the world foiling their enemies&#39; evil plots.","Danger Mouse","series","2019-11-02"
"80218819","18","0","https://occ-0-2851-38.1.nflxso.net/dnm/api/v6/evlCitJPPCVCry0BZlEFb5-QjKc/AAAABYdh-7RspVZHKi5X-H1zARCKi94Vwq7zMJeI_zMYOuwIvOKxIwoTMfjL7R0YSSbeUZsGHuqE7QLH1spCXk6Um0YcY_3fJDhj7dREhYLyr4JyQDFTG9Zsg_SbGyE.jpg?r=bab","","","","2019","","A mysterious classmate leads four idealistic teens in a revolt against a rising tide of nationalistic fervor, but their movement takes a dark turn.","We Are the Wave","series","2019-11-02"
"81084225","18","0","http://occ-0-2851-38.1.nflxso.net/dnm/api/v6/evlCitJPPCVCry0BZlEFb5-QjKc/AAAABQzyHsehWm6JpcUadS7AZWbLRyLHi91rNAu9v6QKRsWBoQBbtvU85pR7KGcsXkGhQWvwouXD46nfz4b7H8ytcJADlp6zU6oMw1Ee2amSNAuF5T90NxE85qag8Ro.jpg?r=e1f","","","","2019","1h5m","Argentine comedian Grego Rossello takes the stage in Buenos Aires to share his takes on modern stardom, airline dining, brotherly love and more.","Grego Rossello: Disculpe las molestias","movie","2019-11-03"
"80114460","18","0","http://occ-0-1490-1489.1.nflxso.net/dnm/api/v6/evlCitJPPCVCry0BZlEFb5-QjKc/AAAABTLjgV9eyuvkmzPraWjwPBxtdhQyA8fhhjq-gc-SuCxNyJh1uyNwbMbhJ77CGgrycYanqVpMO8X_K3EeEDbX5Rpm2Q.jpg?r=782","tt3810760","","6.7","2016","1h18m","People dedicated to rejecting the American ideal that things bring happiness are interviewed in this documentary showing the virtues of less is more.","Minimalism: A Documentary About the Important Things","movie","2019-11-04"
"80191528","18","0","https://occ-0-768-769.1.nflxso.net/dnm/api/v6/evlCitJPPCVCry0BZlEFb5-QjKc/AAAABUyyACKFlcWaA-IDoh0JU5O6ZUMiQyUIoXSr849REFL3OAgxx-qWx8rVUOxeJYSMmVnkTkpVhjcH3ZQR6WC6eKXrBg.jpg?r=9a4","tt5742374","https://occ-0-1091-299.1.nflxso.net/dnm/api/v6/evlCitJPPCVCry0BZlEFb5-QjKc/AAAABV1l5AFs9MW07IHrQ23H6bUMWLcX9nXhJJX50l0YCn_vYyTQ28WKOaR8EchciqfFiOXjT_Ky01bgrQeGuF-DX8_OLAWk.jpg?r=8fc","6.8","2017","1h29m","An emotionally damaged veteran who makes a living by rescuing young women from sex traffickers is hired to save a politician&#39;s daughter.","You Were Never Really Here","movie","2019-11-05"
"80127886","18","1","https://occ-0-2773-2774.1.nflxso.net/dnm/api/v6/evlCitJPPCVCry0BZlEFb5-QjKc/AAAABUCLbpaePTxOA5kqef7eXDl-8B-cY2bE5AL3Fy8qPIuhE4eOeFVKOVlozMpYB3dn0JBf1Z6Qj-IfxDtMp2BTW0h4Fg.jpg?r=52a","tt5377564","","7.5","2016","2h0m","A reporter must hunt for the truth behind a strange murder after she crosses paths with a young cop and becomes the investigation&#39;s prime suspect.","U Turn","movie","2019-11-05"
